id,name,image,type,equipament,charge,FP,effect,locations,dlc
125,Flame of the Redmanes,http://eldenring.wiki.fextralife.com/file/Elden-Ring/flame_of_the_redmanes.gif,Regular,Can be used on all melee armaments.,No,14,"Skill of the Redmanes, who fought alongside General Radahn. Produce a powerful burst of flames in a wide frontward arc.",Dropped by an invisible Teardrop Scarab located in front of the Fort Gael North Site of Grace in Caelid. Elden Ring Map Link.,0
126,Eruption,http://eldenring.wiki.fextralife.com/file/Elden-Ring/eruption.gif,Regular,"Can be used on colossal Swords, Axes, and Hammers.",No,14,"Slam armament into the ground, spawning roiling lava which spouts up upon release.",Sold by Knight Bernahl in Volcano Manor for 8000 . Elden Ring Map Link.,0
127,Prelate's Charge,http://eldenring.wiki.fextralife.com/file/Elden-Ring/skill-prelates-charge-elden-ring-wiki-480px.gif,Regular,Can be used on large and colossal axes and hammers.,Yes,7 (-/7),"Slam armament into the ground to create a surge of flames, then charge in. Hold to continue the charge","Default skill on the Prelate's Inferno Crozier.
A dung beetle hanging on a tree will drop this Ash of War. Located on a Fire Monk campsite located on the Forbidden Lands. South of Whiteridge Road's grace",0
128,Black Flame Tornado,http://eldenring.wiki.fextralife.com/file/Elden-Ring/skill-black-flame-tornado-elden-ring-wiki-480px.gif,Regular,Can be used on Polearms and Twinblades.,Yes,30,Spin armament overhead and then plunge it into the ground to summon a raging vortex of black flames. Hold to create an initial flame tornado while spinning the armament.,"Default skill for the Godskin Peeler twinblade.
Dropped by the Godskin Duo in Crumbling Farum Azula. Elden Ring Map Link.",0
129,Thunderbolt,http://eldenring.wiki.fextralife.com/file/Elden-Ring/thunderbolt_gif_elden_ring_wiki_guide.gif,Regular,Can be used on all melee armaments.,??,10 (-/10),Skill used by the capital's ancient dragon cult. Raise armament aloft to call down a bolt of lightning. Can be fired in rapid succession.,"Dropped by a Teardrop Beetle in Leyndell, Royal Capital. Northwest of the avenue site.",0
130,Lightning Slash,http://eldenring.wiki.fextralife.com/file/Elden-Ring/lightning_slash_gif_elden_ring_wiki_guide.gif,Regular,"Can be used on Swords, Axes, and Hammers.",No,10,"Call down a bolt of lightning into armament, then swing it down to create an explosive shock. The armament retains the lightning enchantment for a while.",Dropped by a Teardrop Scarab in the middle of an enclosed area just outside the Capital Outskirts. Elden Ring Map Link.,0
131,Lightning Ram,http://eldenring.wiki.fextralife.com/file/Elden-Ring/lightning_ram_gif_elden_ring_wiki_guide.gif,Regular,Can be used on all melee armaments.,No,5 (-/5),"Skill inspired by tumbling rams. Let out a bleat, then tumble forwards, clad in lightning. Tumbles can be repeated in rapid succession.","It can be found at Altus Plateau, just south of Sainted Hero's Grave. It drops from a Teardrop Scarab in the area. Elden Ring Map Link.",0
132,Sacred Blade,http://eldenring.wiki.fextralife.com/file/Elden-Ring/skill-sacred-blade-elden-ring-wiki-480px.gif,Regular,"All melee armaments (Whips, Fists, and Claws excepted).",No,19,Grants armament's attacks holy essence and fires off a golden blade projectile. The armament retains its holy essence for awhile.,"Innate skill of the Miquellan Knight's Sword and Inseparable Sword.
Dropped by a Teardrop Scarab North of Third Church of Marika. The location is next to an eye catching whirlwind. Elden Ring Map Link.",0
133,Prayerful Strike,http://eldenring.wiki.fextralife.com/file/Elden-Ring/prayerful_strike_gif_elden_ring_wiki_guide.gif,Regular,Can be used on Axes and Hammers.,No,20,"Raise armament aloft in prayer, then slam it into the ground. This inspired blow restores HP to the self and nearby allies if it successfully hits.","Under the short rocky tunnel on the lake next to the west entrance to Leyndell Royal Capital, dropped by killing the invisible mob that leaves shiny paw prints on its path.",0
134,Sacred Ring of Light,http://eldenring.wiki.fextralife.com/file/Elden-Ring/srol.gif,Regular,Usable on polearms (Great Spears excepted).,No,9 (-/9),"Skill used by the commanders of the Cleanrot Knights. Gather a sacred ring of light in the armament, and then fire it forwards. Can be fired in rapid succession.",Dropped by a Teardrop Scarab found in the Aeonian Swamps in Caelid. Elden Ring Map Link.,0
135,Sacred Order,http://eldenring.wiki.fextralife.com/file/Elden-Ring/sacred_order_gif.gif,Regular,Can be used on all melee armaments.,No,18,Skill of the Golden Order fundamentalist knights. Perform a salute and grant the armament holy essence. Highly effective against Those Who Live in Death.,"Default skill on the Treespear.
Dropped by a Teardrop Scarab in Altus Plateau, just north of the Site of Grace.",0
136,Shared Order,http://eldenring.wiki.fextralife.com/file/Elden-Ring/shared_order_gif_elden_ring_wiki_guide.gif,Regular,Can be used on all melee armaments.,No,20,Skill of the Golden Order fundamentalist knights. Grant the armament and those of nearby allies holy essence. Highly effective against Those Who Live in Death.,"Dropped by a Night's Cavalry in Altus Plateau, next to the Altus Highway Junction Site Of Grace.",0
137,Golden Land,http://eldenring.wiki.fextralife.com/file/Elden-Ring/golden_lands_gif_v2.gif,Regular,"Can be used on Greataxes, Warhammers, and Colossal Weapons.",??,16 (-/5),"Thrust armament into the ground, then gather strength to unleash a blast of sacred energy that coalesces into golden darts. Follow up with a strong attack to swing the armament in a sweeping strike.","Default skill on the Great Club.
Can be found in Deeproot Depths, from the Great Waterfall Crest site of grace, head straight ahead and to the left. There's a scarab that drops it. Fittingly, it is behind the Erdtree Avatar who drops the Staff of the Avatar. Elden Ring Map Link.",0
138,Golden Slam,http://eldenring.wiki.fextralife.com/file/Elden-Ring/golden_slam.gif,Regular,Can be used on all melee armaments.,No,22,Skill of the avatars who protect Minor Erdtrees. Jump up high into the air and crash down on the ground ahead. The resulting pratfall sends golden shockwaves in all directions.,"Gained by killing a Teardrop Scarab northwest of Woodfolk Ruins, near the Altus Plateau Erdtree. Elden Ring Map Link.",0
139,Golden Vow,http://eldenring.wiki.fextralife.com/file/Elden-Ring/skill-golden-vow-elden-ring-wiki-480px.gif,Regular,Can be used on all melee armaments.,No,40,"Skill passed down from antiquity among the knights of the capital. Raise armament aloft and pledge to honor the Erdtree in battle, granting self and nearby allies increased attack power and defense.","Default skill on the Golden Halberd.
Dropped by Godrick Knight upon defeat in Limgrave. Elden Ring Map Link.",0
140,Vow of the Indomitable,http://eldenring.wiki.fextralife.com/file/Elden-Ring/vow_of_the_indomitable.gif,Regular,Can be used on all Shields.,No,20,"Skill of the ancient warriors of the Erdtree. Hold shield aloft to imbue yourself with golden power, granting momentary invincibility.","Liurnia of the Lakes: Dropped by a Teardrop Scarab, in the southwestern swampy area of the map. Elden Ring Map Link.",0
141,Holy Ground,http://eldenring.wiki.fextralife.com/file/Elden-Ring/holy_ground.gif,Regular,Can be used on all Shields.,No,30,Raise shield to create an Erdtree-consecrated area that continuously restores HP and boosts defense for self and allies inside it.,Together with Tree Sentinel Armor set inside Auriza Hero's Grave.,0
142,Poisonous Mist,http://eldenring.wiki.fextralife.com/file/Elden-Ring/poisonous_mist_gif_elden_ring_wiki_guide.gif,Regular,"Usable on certain melee armaments (Whips, Fists, and Claws excepted).",No,14,"Bathe armament in poison, and then slash, spreading toxic mist forwards. The armament retain its poison for a while.",Can be found in Aeonia Swamp in Caelid. Elden Ring Map Link.,0
143,Poison Moth Flight,http://eldenring.wiki.fextralife.com/file/Elden-Ring/poison_moth_flight_gif_elden_ring_wiki_guide.gif,Regular,Can be used on small and medium Swords (Twinblades excepted).,??,7,"Slash with a poison-infused blade. If thefollow-up strike lands on a poisoned foe, it will deal significant damage.",Dropped by Night's Cavalry on Caelid. Elden Ring Map Link.,0
144,Blood Blade,http://eldenring.wiki.fextralife.com/file/Elden-Ring/skill-blood-blade-elden-ring-wiki-480px.gif,Regular,Can be used on small and medium Swords.,No,3 (-/3),"Wound self to coat the armament with blood, then unleash an airborne blood blade that causes hemorrhaging. Can be fired in rapid succession.","Dropped by a Teardrop Scarab in Altus Plateau, northeast of Erdtree-Gazing Hill, above a pond. Elden Ring Map Link.",0
145,Bloody Slash,http://eldenring.wiki.fextralife.com/file/Elden-Ring/bloody_slash.gif,Regular,Can be used on Swords (colossal weapons excepted).,No,6,"Blood Oath skill granted by the Lord of Blood. From a low stance, coat the blade in your own blood to unleash a rending blood slash in a wide arc.",Dropped by a Godrick Knight fought at the top of the ramparts of Fort Haight. Elden Ring Map Link.,0
146,Blood Tax,http://eldenring.wiki.fextralife.com/file/Elden-Ring/bloody_tax.gif,Regular,Can be used on armaments capable of thrusting (Colossal Weapons excepted).,No,14,"Blood Oath skill granted by the Lord of Blood. Twist to build power, then unleash a flurry of thrusts that rob the target of both their blood and their HP","Found in the Mohgwyn Dynasty area in a small cave, at the eastern edge of the blood lake with four blood Albinaurics that appear after killing the beetle.",0
147,Seppuku,http://eldenring.wiki.fextralife.com/file/Elden-Ring/sepukku_gif_elden_ring_wiki_guide.gif,Regular,Can be used on Swords as well as polearms capable of thrusting (small and colossal weapons excepted).,No,4,A forbidden technique used by swordsmen from the Land of Reeds. Plunge the blade into your stomach to stain it with blood. Increases attack power and improves ability to inflict blood loss.,"On the frozen lake next to the ""Freezing Lake"" site of grace, dropped by an invisible scarab. Scarab can be heard on the edge of the lake. Stand on his trail and wait for it to come back around and greet it with attacks.",0
148,Ice Spear,http://eldenring.wiki.fextralife.com/file/Elden-Ring/ice_spear_gif_elden_ring_wiki_guide.gif,Regular,Can be used on Polearms capable of thrusting and Twinblades.,No,15,"Skill of the warriors who served Lunar Princess Ranni. Spin armament to release cold magic, then channel it into a piercing spear of ice.","Ash of War dropped by a Night's Cavalry boss in eastern Liurnia, patrolling near the broken Gate Town Bridge. Only appears at night time. Elden Ring Map Link.",0
149,Chilling Mist,http://eldenring.wiki.fextralife.com/file/Elden-Ring/chilling_mist.gif,Regular,"Can be used on melee armaments (Whips, Fists, and Claws excepted).",No,14,"Coat armament in frost, and then slash, spreading frigid mist forwards. The armament retains its frost for a while.",Can be found in the Three Sisters sub-region. Dropped by a Teardrop Scarab in the ruins south of Renna's Rise. Elden Ring Map Link.,0
150,Hoarfrost Stomp,http://eldenring.wiki.fextralife.com/file/Elden-Ring/ezgif-5-e5e9250e98.gif,Regular,Can be used on all melee armaments.,No,10,Stomp hard to spread a trail of freezing mist on the ground. The mist applies the frost status effect.,Dropped by an invisible Teardrop Scarab found roaming the shallow body of water southeast of Caria Manor. Look for its glowing footprints and attack as they move towards you. Elden Ring Map Link.,0
151,Spectral Lance,http://eldenring.wiki.fextralife.com/file/Elden-Ring/spectral_lance_gif_elden_ring_wiki_guide.gif,Regular,Can be used on Polearms (reapers excepted).,No,9,Skill of the headless Mausoleum Knights. Hurl a phantasmic spear at foes.,Dropped by a Teardrop Scarab located at Raya Lucaria Academy.,0
152,Lifesteal Fist,http://eldenring.wiki.fextralife.com/file/Elden-Ring/skill-lifesteal-fist-elden-ring-wiki-480px.gif,Regular,Can be used on Fists and Claws.,No,14,"Skill that demonstrates mastery of the art of controlling vital energies.A slow, controlled punch with an energy-infused fist that renders foes unconscious and steals their HP. Only effective against foes of human build.",Dropped by a Teardrop Scarab along the Caelid Highway. Elden Ring Map Link.,0
153,White Shadow's Lure,http://eldenring.wiki.fextralife.com/file/Elden-Ring/white_shadow's_lure_gif_elden_ring_wiki_guide.gif,Regular,Can be used on all melee armaments.,No,15,"Hold armament in a brief, silent prayer to create a white shadow. The apparition lures in foes of human build who are not in combat, drawing their aggression. Effective on demi-humans even if they are already in a combat state.","Dropped by an invisible Teardrop Scarab in the Consecrated Snowfield, northwest of the Inner Consecrated Snowfield site of grace between the grace and Ordina, Liturgical Town. The scarab leaves glowing white tracks in the snow and is chased wherever it goes by a pack of five wolves.",0
154,Assassin's Gambit,http://eldenring.wiki.fextralife.com/file/Elden-Ring/assassin's_gambit.gif,Regular,Can be used on small and medium Straight Swords and Thrusting Swords.,No,5,Skill that masks the user's presence at the cost of a self-inflicted wound. Grants near-invisibility and silences footsteps.,Sold by Knight Bernahl in Volcano Manor for 6500 . Note that you will need to fulfill the first contract at Volcano Manor to have access to Knight Bernahl's shop. Elden Ring Map Link.,0
155,Mighty Shot,http://eldenring.wiki.fextralife.com/file/Elden-Ring/skill-mighty-shot-elden-ring-wiki-480px.gif,Regular,Can be used on Light Bows and Longbows.,No,-1,"Archery skill performed from an oblique stance. Ready the bow, then pull the bowstring to its limit to enhance the power of the shot, penetrating the enemy's guard.",Dropped by a Teardrop Scarab on the path from Limgrave towards Weeping Peninsula. Elden Ring Map Link.,0
156,Through and Through,http://eldenring.wiki.fextralife.com/file/Elden-Ring/through_and_through.gif,Regular,Can be used on Greatbows.,No,-1,"Powerful archery skill using a greatbow held in an oblique stance.Ready the greatbow, then twist the bowstring to fire a mighty greatarrow that can penetrate through enemies.","Default skill of the Greatbow.
Can be found on an Invisible Scarab just outside Volcano Manor in the Altus Plateau.",0
157,Barrage,http://eldenring.wiki.fextralife.com/file/Elden-Ring/barrage.gif,Regular,Can be used on Light Bows.,No,-1,"Archery Skill using a bow held horizontally. Ready the bow, then fire off a rapid succession of shots faster than the eye can see.","Default skill on the Shortbow.
Dropped by a Teardrop Scarab found in the narrow channel north of Seethewater River in Mt. Gelmir. Elden Ring Map Link.",0
158,Sky Shot,http://eldenring.wiki.fextralife.com/file/Elden-Ring/sky_shot.gif,Regular,Can be used Light Bows and Longbows.,No,-1,"Archery skill performed from a low stance. Ready the bow, then fire an arrow high up into the air, arcing so as to strike the enemy from abose when it comes down.",Dropped by a Teardrop Scarab found on the cliffs northwest of the Isolated Merchant's Shack in Dragonbarrow. Elden Ring Map Link.,0
159,Enchanted Shot,http://eldenring.wiki.fextralife.com/file/Elden-Ring/enchanted_shot.gif,Regular,Can be used on Light Bows and Longbows.,No,-1,Archery skill that enlivens the arrow with spiritual essence. The resulting shot will fly faster than regular shots and change its trajectory to follow the target.,"Dropped by a Teardrop Beetle hiding behind a rock near a brazier in Nokron, Eternal City. Elden Ring Map Link.",0
160,Rain of Arrows,http://eldenring.wiki.fextralife.com/file/Elden-Ring/skill-rain-of-arrows-elden-ring-wiki-480px.gif,Regular,Can be used on all Bows.,No,-1,"Archery skill performed from a low stance. Ready the bow, then fire a burst of arrows into the sky to shower the enemy with projectiles.","Can be found in Caelid, it appears at an edge of a cliff after you've looted the ""Redmane"" Painting in Sellia, Town of Sorcery. You'll find it down the cliff on a plateau south east of the Minor Erdtre. [Elden Ring Map Link]",0
161,Parry Skill,http://eldenring.wiki.fextralife.com/file/Elden-Ring/parry.gif,Regular,"Can be used on Daggers, Curved Swords, Thrusting Swords, Fists, Claws, and small and medium Shields.",No,-,Use this skill in time with a foe's melee attack to deflect it and break that foe's stance. This provides an opening to perform a critical hit.,"Sold by Knight Bernahl at the Warmaster's Shack for 600 . Elden Ring Map Link.
Can be purchased from Twin Maiden Husks at the Roundtable Hold after giving them Bernahl's Bell Bearing.",0
162,Golden Parry,http://eldenring.wiki.fextralife.com/file/Elden-Ring/golden_parry_gif_elden_ring_wiki_guide.gif,Regular,Can be used on small and medium Shields.,No,4,Perform an Erdtree incantation and swing the shield to deflect enemy attacks and break their stance. Effective even at a slight distance.,Dropped by a Teardrop Scarab within Capital Outskirts. Elden Ring Map Link.,0
163,Storm Wall,http://eldenring.wiki.fextralife.com/file/Elden-Ring/storm_wall_gif_elden_ring_wiki_guide.gif,Regular,Can be used on small and medium Shields,No,3,"Swing the shield to create a wall of storm winds in front of you, deflecting arrows and other such physical projectiles. Can also be used in the same way as a regular parry.",Can be found by defeating a Teardrop Scarab found by falling down from the collapsed bridge at the north of Stormhill next to Stormveil Castle. Elden Ring Map Link.,0
164,Shield Bash,http://eldenring.wiki.fextralife.com/file/Elden-Ring/skill-shield-bash-elden-ring-wiki-480px.gif,Regular,Can be used on all Shields.,No,10,"Brace behind shield before using bodyweight to ram foes while maintaining guarding stance.Weaker enemies will be shoved backwards, and can even be staggered.","Default skill for the Dragonclaw Shield and Briar Greatshield.
Liurnia of the Lakes: Dropped by a Teardrop Scarab under a bridge very close to East Gate Bridge Trestle site of grace. Elden Ring Map Link.
Dropped by a beetle in the island below the broken bridge connecting Raya Lucaria Academy and East Raya Lucaria Gate. Elden Ring Map Link.",0
165,Shield Crash,http://eldenring.wiki.fextralife.com/file/Elden-Ring/skill-shield-crash-elden-ring-wiki-480px.gif,Regular,Can be used on all Shields.,Yes,12,Two-hand the shield and charge forwards while maintaining guard. Weaker enemies will be shoved backwards and can even be staggered. Hold to extend the duration of the charge forwards.,"Dropped by a Teardrop Scarab in Lux Ruins, Altus Plateau. Elden Ring Map Link.",0
166,Barricade Shield,http://eldenring.wiki.fextralife.com/file/Elden-Ring/skill-barricade-shield-elden-ring-wiki-480px.gif,Regular,Can be used on all Shields.,No,12,"Focus your energy into your shield, temporarily hardening it todeflect greater blows.It can be used on all types of shield.","Dropped by Night's Cavalry at Weeping Peninsula. Elden Ring Map Link.
Dropped by Bloodhound Knight Darriwil in Forlon Hound Evergaol, Stormhill.",0
167,Thops's Barrier,http://eldenring.wiki.fextralife.com/file/Elden-Ring/thop's_barrier_gif_elden_ring_wiki_guide.gif,Regular,Can be used on small and medium Shields.,??,-,Erect a magical forcefield while swinging the shield to deflect sorceries and incantations. Can also be used in the same way as a regular parry.,In Church of Irith: Dropped by a Teardrop Scarab after delivering the spare Academy Glintstone Key to Thops. Reload the area after delivering the key to spawn the scarab. [Map Link],0
168,Carian Retaliation,http://eldenring.wiki.fextralife.com/file/Elden-Ring/carian_retaliation_gid_elden_ring_wiki_guide.gif,Regular,Can be used on light and medium Shields,No,8,"Swing the shield to dispel incoming sorceries and incantations, transforming the magic into retaliatory glintblades. Can also be used in the same way as a regular parry.","Sold by Pidia, Carian Servant at Caria Manor: on a balcony above the Manor Lower Level bonfire. Only accessible by dropping down the cliffs from the southwestern side of the Three Sisters sub-area.
In the western part of Liurnia is the Temple Quarter Grace Site. Directly to the northwest of it is a small island surrounded by flying beetles upon which is a beetle that drops this particular Ash of War. One can get to this location with little to no fighting of enemies, particularly if they skip past Stormveil Castle.",0
169,No Skill,https://eldenring.wiki.fextralife.com/file/Elden-Ring/ash_of_war_no_skill_elden_ring_wiki_guide_200px.png,Regular,Can be used on Shields and Torches.,-,0,"This armament has no skill. If the armament in the other hand has a skill, that skill will be used instead.""Usable on shields and torches","Sold by Knight Bernahl at the Warmaster's Shack for 600 . Elden Ring Map Link.
Can be purchased from Twin Maiden Husks at the Roundtable Hold after giving them Bernahl's Bell Bearing.",0
170,Torch Attack,http://eldenring.wiki.fextralife.com/file/Elden-Ring/skill-torch-attack-elden-ring-wiki-480px.gif,Unique,Can be used on all Torches.,No,-,Thrust your torch forward to set foes ablaze. This Skill is especially effective against foes who are weak to fire.,The Torch can be purchased from Kale in the Church of Elleh for 200 . Elden Ring Map Link.,0
171,Spinning Chain,http://eldenring.wiki.fextralife.com/file/Elden-Ring/skill-spinning-chain-elden-ring-wiki-480px.gif,Regular,Can be used on Flails.,No,8 (8 10),Spins the striking part of a flail at high speed to attack. Follow up with a normal or strong attack to link the momentum of this skill into a successful attack.,"Default skill on the Flail, Nightrider Flail and Chainlink Flail.",0
172,Firebreather,http://eldenring.wiki.fextralife.com/file/Elden-Ring/skill-firebreather-elden-ring-wiki-480px.gif,Unique,Steel-Wire Torch,No,8,"Blow into torch flame, spreading flames in a wide frontward arc. The flames on the ground will continue to burn for a short time.",Default skill of the Steel-Wire Torch.,0
173,Buckler Parry,http://eldenring.wiki.fextralife.com/file/Elden-Ring/buckler-parry-skill-elden-ring-wiki-guide.jpg,Unique,Buckler,No,-,Use this Skill in time with a foe's melee attack to deflect it and break that foe's stance.,Default skill for the Buckler.,0
174,Surge of Faith,http://eldenring.wiki.fextralife.com/file/Elden-Ring/skill-surge-of-faith-elden-ring-wiki-480px.gif,Unique,Cranial Vessel Candlestand,No,15 (-15),"Set the flames of Birac's faith ablaze in the cranial vessel, thenraise it aloft to rain down fireballs in all directions.Repeated inputs will continue to raise the armament aloft,continuing the attack.",Default skill on the Cranial Vessel Candlestand.,0
175,Flame Spit,http://eldenring.wiki.fextralife.com/file/Elden-Ring/skill-flame-spit-elden-ring-wiki-480px.gif,Unique,One-Eyed Shield,No,28,"Ready the shield, then launch a fireball from the barrel. The fireball explodes on impact.",Default skill on the One-Eyed Shield.,0
176,Tongues of Fire,http://eldenring.wiki.fextralife.com/file/Elden-Ring/skill-tongues-of-fire-elden-ring-wiki-480px.gif,Unique,Visage Shield,No,5,"Ready the shield, then spray violent jets of fire from the tongues protruding from its maw. Hold to continue spraying fire. This skill can be used while walking.",Default skill on the Visage Shield.,0
177,Oracular Bubble,http://eldenring.wiki.fextralife.com/file/Elden-Ring/skill-oracular-bubble-elden-ring-wiki-480px.gif,Unique,Envoy's Horn,No,6,Blow on the horn to release a magic bubble. The bubble floats gently through the air towards its target.,Default skill on the Envoy's Horn.,0
178,Bubble Shower,http://eldenring.wiki.fextralife.com/file/Elden-Ring/skill-bubble-shower-elden-ring-wiki-480px.gif,Unique,Envoy's Long Horn,No,16,Blow on the horn to release a spume of magic bubbles. The bubbles float gently before raining down on the target.,Default skill on the Envoy's Long Horn.,0
179,Great Oracular Bubble Skill,http://eldenring.wiki.fextralife.com/file/Elden-Ring/skill-great-oracular-bubble-elden-ring-wiki-480px.gif,Unique,Envoy's Greathorn,No,28,Blow on the horn to release a massive magic bubble. The bubble floats gently through the air towards its target.,Default skill on the Envoy's Greathorn.,0
180,Sea of Magma,http://eldenring.wiki.fextralife.com/file/Elden-Ring/skill-sea-of-magma-elden-ring-wiki-480px.gif,Unique,Magma Whip Candlestick,Yes,5 (-5),Swing a molten whip overhead to temporarily cover the surrounding area in a sea of magma. Hold to continue swinging the lava whip.,Default skill on the Magma Whip Candlestick.,0
181,Viper Bite,http://eldenring.wiki.fextralife.com/file/Elden-Ring/skill-viper-bite-elden-ring-wiki-480px.gif,Unique,Coil Shield,No,8,"Give the shield a quick shake to temporarily bring the bronze viper to life, inciting it to lash out and bite foes.",Default skill on the Coil Shield.,0
182,Moonlight Greatsword,http://eldenring.wiki.fextralife.com/file/Elden-Ring/skill-moonlight-greatsword-elden-ring-wiki-480px.gif,Unique,Dark Moon Greatsword,No,40,"Raise the sword aloft, bathing it in the light of the dark moon.Temporarily increases magic attack power and imbues blade with frost.Charged attacks release blasts of moonlight.",Default skill on the Dark Moon Greatsword.,0
183,Siluria's Woe,http://eldenring.wiki.fextralife.com/file/Elden-Ring/skill-silurias-woe-elden-ring-wiki-480px.gif,Unique,Siluria's Tree,Yes,25,"Thrust the treespear in a spiraling motion, surrounding it in a vortex of wind. Charged attacks have the power to blow away enemies and can fire the tornado forwards.",Default skill on the Siluria's Tree.,0
