id,name,image,type,equipament,charge,FP,effect,locations,dlc
0,Dryleaf Whirlwind,http://eldenring.wiki.fextralife.com/file/Elden-Ring/dryleaf_whirlwind.gif,Regular,Usable on Hand-to-Hand Arts,No,9 (-/-),"This skill represents the pinnacle of Dane's footwork-based martial artistry. Rise into the air with a series of spinning kicks before crashing down with one final strike. Imbues kicking attacks with energy, increasing their range.",Ash of War Dryleaf Whirlwind,1
1,Aspects of the Crucible: Wings,https://eldenring.wiki.fextralife.com/file/Elden-Ring/aspect_of_the_crucible_wings.gif,Regular,All Swords and Polearms capable of Thrusting (Except Colossal Weapons),No,22 (-/-),"This skill originates from the lifeforms of the Crucible. Grow a golden pair of wings and take to the air before diving down at the foe, weapon first. A spinning attack is performed when wielding a twinblade.",Ash of War: Aspects of the Crucible: Wings,1
2,Spinning Gravity Thrust,https://eldenring.wiki.fextralife.com/file/Elden-Ring/aspect_of_the_crucible_wings.gif,Regular,Usable on large and colossal swords,No,26 (-/12),A gravity skill honed by the disciples of an Alabaster Lord. Uses gravitational power to hang in the air before rotating the body and charging forward. An additional input allows for a follow-up attack.,Ash of War Spinning Gravity Thrust,1
3,Palm Blast,http://eldenring.wiki.fextralife.com/file/Elden-Ring/palm-blast.gif,Regular,Usable on Hand-to-Hand Arts,Yes,14 (-/-),Skill of the spiritual seekers known as the Dryleaf Sect. Imbues hand with energy before using a palm strike to unleash an explosive blast. The already formidable power and impact can be bolstered by charging the attack.,Ash of War Palm Blast,1
4,Piercing Throw,http://eldenring.wiki.fextralife.com/file/Elden-Ring/smithscript-dagger---piercing-throw.gif,Regular,Usable on Throwing Blades,No,6 (-/-),"Throw armament with a powerful spin, causing it to bore through foes. When using this skill, the armament can be thrown further than normal and also pierce through enemies",Ash of War Piercing Throw,1
5,Scattershot Throw,http://eldenring.wiki.fextralife.com/file/Elden-Ring/scattershot-throw.gif,Regular,Usable on Throwing Blades,No,11 (-/11),Employ smithing arts to conjure multiple copies of the armament in both hands and throw them all at once. Follow up with an additional input to throw again.,Ash of War Scattershot Throw,1
6,Wall of Sparks,https://eldenring.wiki.fextralife.com/file/Elden-Ring/wall_of_sparks.gif,Regular,Usable on Perfume Bottles,Yes,16 (-/-),"catter perfumed powder in vicinity, producing intense sparks after a brief delay. Can be charged to increase power and range. The properties of the sparks are determined by the perfume bottle used.",Ash of War Wall of Sparks,1
7,Rolling Sparks,http://eldenring.wiki.fextralife.com/file/Elden-Ring/rolling+sparks+temp.png,Regular,Usable on Perfume Bottles,No,14 (-/-),"Scatter perfumed powder before you, triggering rolling explosions of deadly sparks. The properties of the sparks are determined by the perfume bottle used.",Ash of War Rolling Sparks,1
8,Raging Beast,https://eldenring.wiki.fextralife.com/file/Elden-Ring/raging_beast.gif,Regular,Usable on Beast Claws,No,7 (-/7),"Step with the swiftness of a beast, leap high, and slash foe from above. Initial step can be taken forward, backward, left, or right. Strong attack allows for a follow-up attack.",Ash of War Raging Beast,1
9,Savage Claws,http://eldenring.wiki.fextralife.com/file/Elden-Ring/best-claw---savage-claws.gif,Regular,Usable on Beast Claws,No,13 (-/-),Pounce like a beast to viciously slash into foe with left and right claws.,Ash of War Savage Claws,1
10,Red Bear Hunt,https://eldenring.wiki.fextralife.com/file/Elden-Ring/red_bear_hunt2.gif,Unique,Red Bear's Claw,No,8 (-/8),Slaughters prey with sharp claws in a great swipe of the arm. The attack creates a vacuum which deals continuous damage. Repeated inputs allow for up to two follow-up attacks.,Default skill of Red Bear's Claw,1
11,Blind Spot,http://eldenring.wiki.fextralife.com/file/Elden-Ring/blind_spot.gif,Regular,Usable on Backhand Blades,No,9 (-/-),Leap into close quarters to take advantage of the enemy's blind spot and gore them from the side. Inputs determine which side you strike from. This attack slips below the opponent's guard.,Ash of War Blind Spot,1
12,Swift Slash,https://eldenring.wiki.fextralife.com/file/Elden-Ring/swift_slash2.gif,Regular,Usable on Backhand Blades,No,16 (-/-),A skill passed down amongst hornsent swordsmen. Take a swift forward step to slice through foes. This sharp strike also fires off a shearing vacuum. Can be charged to increase the skill's power and the distance of the forward step.,Ash of War Swift Slash,1
13,Overhead Stance,https://eldenring.wiki.fextralife.com/file/Elden-Ring/overhead_stance.gif,Regular,Usable on Great Katanas,No,-0.8,"A skill that starts with the blade held high in a ready stance. Execute a normal attack from this stance to step forward and slash downwards, or a strong attack to deliver a series of downward slashes.",Ash of War Overhead Stance,1
14,Wing Stance,http://eldenring.wiki.fextralife.com/file/Elden-Ring/wing_stance.gif,Regular,Usable on Light Greatswords,No,-0.8,Calmly assume a right-sided stance. Normal attack triggers a rapid three-slash combination. Strong attack triggers a leaping thrust.,Ash of War Wing Stance,1
15,Blinkbolt,https://eldenring.wiki.fextralife.com/file/Elden-Ring/blinkbolt.gif,Regular,Usable on all Melee Armaments,No,8 (-/-),"Skill used by the golden knights who served Godwyn. From a low stance, the body is transformed into a bolt of lightning and charges straight ahead at fulgurous speed.",Ash of War Blinkbolt,1
16,Flame Skewer,https://eldenring.wiki.fextralife.com/file/Elden-Ring/flame_skewer.gif,Regular,Usable on medium and large armaments capable of thrusting,No,18 (-/8),Skill of Queelign of the Fire Knights. Enwreathe armament in flame and assume a low stance before skewering the enemy in a single motion. Strong attack unleashes a follow-up flame attack.,Ash of War Flame Skewer,1
17,Savage Lion's Claw,http://eldenring.wiki.fextralife.com/file/Elden-Ring/savage_lions_claw_gif.gif,Regular,"Usable on Swords, Axes, and Hammers. (small armaments and thrusting swords excepted)",No,20 (-/10),"Skill of the particularly brave, even among the Redmanes. Somersault forwards, striking foes with armament. An additional strike may be performed with an additional input.",Ash of War Savage Lion's Claw,1
18,Divine Beast Frost Stomp,https://eldenring.wiki.fextralife.com/file/Elden-Ring/divine_beast_frost_stomp.gif,Regular,Usable on all melee weapons.,Yes,15 (-/-),A skill which imitates the wrath of the divine beast's dance. Lift a leg up high and stamp it down with great force. Sends a powerful wave of frost straight out along the ground. Can be charged to increase power and range.,Ash of War Divine Beast Frost Stomp,1
19,Flame Spear,https://eldenring.wiki.fextralife.com/file/Elden-Ring/flame_spear.gif,Regular,Usable on armaments capable of thrusting (claws and backhand blades excepted).,Yes,19 (-/-),"Skill of Kood, captain of the Fire Knights. Ready weapon for a thrusting attack and unleash a spear of flame straight ahead. Charge the attack to increase damage dealt and distance travelled.",Ash of War Flame Spear,1
20,Carian Sovereignty,http://eldenring.wiki.fextralife.com/file/Elden-Ring/carian_sovereignty.gif,Regular,Usable on swords (colossal weapons excepted).,Yes,30 (-/12),Skill passed down the Carian royal family. Transform blade into a magical greatsword and bring it down. Additional input follows up with a horizontal sweep. Charge either attack to enhance potency.,Ash of War Carian Sovereignty,1
21,Shriek of Sorrow,https://eldenring.wiki.fextralife.com/file/Elden-Ring/shirek_of_sorrow.gif,Regular,Usable on all melee armaments.,No,19 (-/-),"Skill utilized by the downtrodden. Scream, causing nearby enemies to flinch, while also recalling deep-seated resentment, boosting attack power based on the amount of HP remaining. The lower the HP, the greater the effect.",Ash of War Shriek of Sorrow,1
22,Shield Strike,https://eldenring.wiki.fextralife.com/file/Elden-Ring/shield_strike.gif,Regular,Usable on all Shields.,No,- (-/-),A skill that uses the shield to attack. Repeated inputs allow for up to three follow-up attacks.,Ash of War Shield Strike,1
23,Igon's Drake Hunt,https://eldenring.wiki.fextralife.com/file/Elden-Ring/igons_drake_hunt.gif,Regular,Usable on Greatbows.,No,-1,"Skill of Igon, drake warrior. Ready the bow before unleashing a twisted shot with a great bellow that considerably enhances its power.",Ash of War Igon's Drake Hunt,1
24,Ghostflame Call,https://eldenring.wiki.fextralife.com/file/Elden-Ring/ghostflame_call.gif,Regular,"Usable on swords and spears (small armaments, twinblades, and backhand blades excepted).",No,15 (10/10),"Thrust out armament to summon ghostflame. Follow up with a normal attack to set the ground ablaze with ghostflame, or a strong attack to trigger a massive explosion.",Ash of War Ghostflame Call,1
25,Dragonwound Slash,http://eldenring.wiki.fextralife.com/file/Elden-Ring/dragon-hunters-great-katana---dragonwound-slash.gif,Unique,Dragon Hunter's Great Katana,Yes,18 (-/-),"Designed to hunt colossal dragons, this skill cloaks the armament with a jagged gravel-stone aura before performing a high leaping slash. Charge the attack to also fire off the aura.",Default skill of Dragon Hunter's Great Katana.,1
26,Needle Piercer,http://eldenring.wiki.fextralife.com/file/Elden-Ring/needle-piercer.gif,Unique,Leda's Sword,No,19 (-/-),Skill of Needle Knight Leda. Generates ten gold needles which pierce their target all at once. Those pierced are purged of all ailments and special effects alike.,Default skill of Leda's Sword,1
27,Light,http://eldenring.wiki.fextralife.com/file/Elden-Ring/sword-of-light---light.gif,Unique,Sword of Light,No,30 (-/-),Unleashes the light carved in the armament's blade. Send the sword aloft to let loose a blinding light whose many rays sweep through the surrounding area. Also temporarily boosts one's own holy attacks.,Default skill of Sword of Light.,1
28,Darkness,http://eldenring.wiki.fextralife.com/file/Elden-Ring/sword-of-darkness---darkness.gif,Unique,Sword of Darkness,No,30 (-/-),Raise the sword aloft and cleave surroundings with darkness. Deals holy damage and temporarily reduces holy damage negation.,Default skill of Sword of Darkness.,1
29,Onze's Line of Stars,http://eldenring.wiki.fextralife.com/file/Elden-Ring/onze's-line-of-stars.gif,Unique,Star-Lined Sword,No,10 (-/8),"Imbues sorcerous energy into the glintstone line for enhanced slashing attacks. Repeated inputs allow for up to two follow-up attacks, each dealing greater damage than the last.",Default skill of Star-Lined Sword.,1
30,The Poison Flower Blooms Twice,https://eldenring.wiki.fextralife.com/file/Elden-Ring/the_poison_flower_blooms_twice.gif,Regular,Usable on all Melee Armaments,No,14 (-/-),Conjures stingers of scarlet rot from below to stab the enemy. Landing a follow-up attack on a foe already inflicted with poison or rot deals massive damage in one fell swoop.,Ash of War: The Poison Flower Blooms Twice,1
31,Spinning Guillotine,http://eldenring.wiki.fextralife.com/file/Elden-Ring/spinning-guillotine-heavy.gif,Unique,Putrescence Cleaver,No,12 (-/7),Hold the putrid blade at both ends and arch body backwards to deliver a powerful overhead chop. Repeated inputs deliver follow-up attacks for as long as stamina allows. Strong attack performs a leap followed by a spinning attack.,Default skill of Putrescence Cleaver.,1
32,Unending Dance,http://eldenring.wiki.fextralife.com/file/Elden-Ring/unending-dance.gif,Unique,Dancing Blade of Ranah,Yes,2 (-/-),A furious dance formed by a succession of slashing attacks. Hold the button down to sustain the dance for as long as stamina allows.,Default skill of the Dancing Blade of Ranah.,1
33,Revenger's Blade,http://eldenring.wiki.fextralife.com/file/Elden-Ring/falx---revenger's-blade.gif,Unique,Falx,Yes,15 (-/10),"Dash up to an enemy and slash them open with the blades held in each hand. By holding down the button, the initial dash will be extended. Follow up with strong attack to hack the enemy to pieces.",Default skill of Falx,1
34,Mists of Eternal Sleep,http://eldenring.wiki.fextralife.com/file/Elden-Ring/velvet-sword-of-st.-trina---mists-of-eternal-sleep.gif,Unique,Velvet Sword of St Trina,No,23 (-/-),Releases a velvety purple mist that spreads across a wide frontal area. Afflicts foes with eternal sleep.,Default skill of Velvet Sword of St Trina.,1
35,Dynastic Sickleplay,https://eldenring.wiki.fextralife.com/file/Elden-Ring/dynastic_sickleplay.gif,Unique,Obsidian Lamina,No,5 (-/8),A finessed evasive skill that creates space to maneuver. Inputs dictate direction of the backstep. Follow up with strong attack to perform an advancing upward slash. Press strong attack again to bring the weapon back down.,Default skill of Obsidian Lamina,1
36,Blinkbolt: Twinaxe,https://eldenring.wiki.fextralife.com/file/Elden-Ring/blinkbolt_twinaxe_2.gif,Unique,Death Knight's Twin Axes,No,8 (-/10),"From a low stance, the body is transformed into a bolt of lightning and charges straight ahead at fulgurous speed. Strong attack performs a lightning-charged spinning slash.",Default skill of the Death Knight's Twin Axes.,1
37,Blinkbolt: Long-hafted Axe,https://eldenring.wiki.fextralife.com/file/Elden-Ring/blinkbolt_long-hafted_axe2.gif,Unique,Death Knight's Longhaft Axe,No,8 (-/13),"From a low stance, the body is transformed into a bolt of lightning and charges straight ahead at fulgurous speed. Strong attack performs a lightning-charged leaping slash.",Default skill of the Death Knight's Longhaft Axe.,1
38,Promised Consort,http://eldenring.wiki.fextralife.com/file/Elden-Ring/promised-consort.gif,Unique,Greatsword of Radahn (Lord),No,20 (-/10),"Imbue the two greatswords with the light of Miquella, then deliver a slashing attack accompanied by columns of light. Additional input allows for up to two follow-up attacks.",Default skill of Greatsword of Radahn (Lord),1
39,Shadow Sunflower Headbutt,https://eldenring.wiki.fextralife.com/file/Elden-Ring/shadow_sunflower_headbutt.gif,Unique,Shadow Sunflower Blossom,No,16 (-/8),"Slam down the blossom of a large shadow sunflower, sending out a shockwave that flattens foes. Repeated inputs allow for up to two follow-up attacks.",Default skill of Shadow Sunflower Blossom.,1
40,Moon-and-Fire Stance,http://eldenring.wiki.fextralife.com/file/Elden-Ring/moon-and-fire-stance.gif,Unique,Rellana's Twinblade,No,-0.4,"Assume ready stance, swords imbued with magic. Follow up with normal attack to cast glintstone light waves, or strong attack to perform a spinning attack that bathes the area with flame. Light waves can have up to two follow-up casts with additional inputs.",Default skill of Rellana's Twinblade.,1
41,Devonia's Vortex,https://eldenring.wiki.fextralife.com/file/Elden-Ring/devonias_vortex.gif,Unique,Devonia's Hammer,Yes,16 (-/-),"Using the power of the Crucible vortex, violently spin the hammer around and slam the ground, causing a shockwave. This skill can be charged to increase its power.",Default skill of Devonia's Hammer,1
42,Messmer's Assault,http://eldenring.wiki.fextralife.com/file/Elden-Ring/messmers-assault.gif,Unique,Spear of the Impaler,No,15 (-/9),"A fierce succession of attacks using a flame-coated spear tip. Repeated inputs allow up to two follow-up attacks. The final move thrusts the spear into the ground, causing countless spears to form in the surrounding area.",Default skill of Spear of the Impaler.,1
43,Sleep Evermore,https://eldenring.wiki.fextralife.com/file/Elden-Ring/sleep_evermore_elden_ring_fextralife.gif,Unique,Thiollier's Hidden Needle,No,16 (-/-),"Pierces the enemy deeply with a poison-coated needle that delivers eternal sleep. If the follow-up strike lands upon a foe who is already in a state of slumber or eternal sleep, it will deal significant damage.",Default skill of Thiollier's Hidden Needle.,1
44,Golden Crux,http://eldenring.wiki.fextralife.com/file/Elden-Ring/golden-crux.gif,Unique,Greatsword of Damnation,No,21 (-/10),"Leap up and skewer foe from overhead. If successful, the weapon's barbs unfold to excruciate from within; else, additional input releases barbs in the area. There is something of the Golden Order in the sight of those fixed upon this crux.",Default skill of the Greatsword of Damnation,1
45,Moore's Charge,https://eldenring.wiki.fextralife.com/file/Elden-Ring/moores_charge.gif,Unique,Verdigris Greatshield,Yes,16 (-/-),"Ready the shield with both hands, then charge forth while maintaining guard, ending in a shove imbued with verdigris magic. Knocks back nearby enemies, but does not cause significant harm. Hold to extend the length of the charge.",Default skill of Verdigris Greatshield.,1
46,White Light Charge,http://eldenring.wiki.fextralife.com/file/Elden-Ring/white-light-charge.gif,Unique,Ancient Meteoric Ore Greatsword,No,10 (-/25),"Summons white light from the crevice in the weapon's ancient meteoric ore, using its power for a charging attack which pierces foes. Additional input causes the light to explode.",Default skill of the Ancient Meteoric Ore Greatsword.,1
47,Rancor Slash,http://eldenring.wiki.fextralife.com/file/Elden-Ring/rancor-slash.gif,Unique,Spirit Glaive and Spirit Sword,No,12 (-/12),"Spin around, slashing foes while summoning vengeful spirits which chase down foes. Additional input allows for a follow-up attack.",Default skill of both the Spirit Glaive and the Spirit Sword.,1
48,Witching Hour Slash,http://eldenring.wiki.fextralife.com/file/Elden-Ring/witching-hour-slash.gif,Unique,Sword of Night,Yes,21 (-/-),Slash Hold the sword level and infuse it with the dark of Night before unleashing a series of incorporeal attacks. This attack cannot be blocked. Can be charged to increase its power.,Default skill of Sword of Night.,1
49,Euporia Vortex,https://eldenring.wiki.fextralife.com/file/Elden-Ring/euporia_vortex.gif,Unique,Euporia,No,28 (-/-),"Using the power of the vortex, violently twirl the armament, dealing multiple slashes directly ahead. The greater the restored luster of the blades, the greater the power of this skill. However, use of this skill will fully consume the blades' luster.",Default skill of Euporia.,1
50,Smithing Art Spears,https://eldenring.wiki.fextralife.com/file/Elden-Ring/smithing_art_spears.gif,Unique,Anvil Hammer,No,18 (-/-),"Slam the red-hot anvil into the ground, sending up countless spears as it is pulled out. The spears disappear instantly.",Default skill of the Anvil Hammer,1
51,Romina's Purification,http://eldenring.wiki.fextralife.com/file/Elden-Ring/rominas-purification.gif,Unique,Poleblade of the Bud,No,24 (-/-),Imbues bud-blade with scarlet rot butterflies before unleashing two large sweeping slashes. This was once considered a sacred act of purification.,Default skill of Poleblade of the Bud.,1
52,Poison Spear-Hand Strike,https://eldenring.wiki.fextralife.com/file/Elden-Ring/poison_spear-hand_strike.gif,Unique,Poisoned Hand,No,13 (-/-),Makes hand into the shape of a spear before unleashing a plunging stab that penetrates the body of the enemy. Afflicts foe with a large dose of deadly poison.,Default skill of Poisoned Hand.,1
53,Madding Spear-Hand Strike,https://eldenring.wiki.fextralife.com/file/Elden-Ring/madding_spear-hand_strike.gif,Unique,Madding Hand,No,13 (-/-),Makes hand into the shape of a spear before unleashing a plunging stab that penetrates the body of the enemy. Afflicts foe with a large dose of madness.,Default skill of Madding Hand.,1
54,Feeble Lord's Frenzied Flame,https://eldenring.wiki.fextralife.com/file/Elden-Ring/feeble_lords_frenzied_flame.gif,Unique,Nanaya's Torch,Yes,3 (-/-),"Hold torch out in front and spit out frenzied flame. Afflicts those caught in its area of effect with madness, along with the user themselves. The skill will continue for as long as the button is held down. Can be used while moving.",Default skill of Nanaya's Torch,1
55,Repeating Fire,https://eldenring.wiki.fextralife.com/file/Elden-Ring/repeating_fire.gif,Unique,Repeating Crossbow,No,- (26/26),"This skill readies the weapon's rapid-fire mechanism. Once in ready stance, crank the handle to fire bolts in rapid succession.",Default skill of Repeating Crossbow.,1
56,Deadly Dance,http://eldenring.wiki.fextralife.com/file/Elden-Ring/deadly-dance.gif,Unique,Curseblade's Cirque,No,15 (-/8)z,An aggressive spinning skill that tears into foes using the circular blades held in each hand. Additional input allows for a sharp axe-kick follow-up.,Default skill of the Curseblade's Cirque,1
57,Fan Shot,https://eldenring.wiki.fextralife.com/file/Elden-Ring/fan_shot2.gif,Unique,Ansbach's Longbow,No,-1,"This skill uses the bow held horizontally. Readies eight arrows at once, firing them in a fan-shaped arc.",Default skill of the Ansbach's Longbow.,1
58,Discus Hurl,http://eldenring.wiki.fextralife.com/file/Elden-Ring/ezgif.com-video-to-gif-converter_(1).gif,Unique,Smithscript Shield,No,3 (-/-),"Throws the roundshield like a discus. Once thrown, the shield will be instantly restored to the wielder's hand through the smithing arts.",Default skill of Smithscript Shield.,1
59,Flower Dragonbolt,https://eldenring.wiki.fextralife.com/file/Elden-Ring/flower_dragonbolt.gif,Unique,Flowerstone Gavel,Yes,18 (-/-),Calls down the red lightning of the ancient dragons to strike a target. Deals lightning damage and also temporarily reduces the target's lightning damage negation. Can be charged to increase its power.,Default skill of Flowerstone Gavel.,1
60,Kowtower's Resentment,https://eldenring.wiki.fextralife.com/file/Elden-Ring/kowtowers_resentment.gif,Unique,Gazing Finger,Yes,31 (-/-),"Skill performed as a violent bow using a finger's foremost protrusion. Resentment builds as it is forced to bow, making it explode with anger. Hold button down to further increase resentment.",Default skill of Gazing Finger.,1
61,Painful Strike,https://eldenring.wiki.fextralife.com/file/Elden-Ring/painful_strike.gif,Unique,Tooth Whip,No,16 (-/-),"A chastening whip strike, honed to maximize pain. Temporarily reduces the rate at which stamina recovers. Thus does the pain encourage obedience.",Default skill of Tooth Whip.,1
62,Solitary Moon Slash,http://eldenring.wiki.fextralife.com/file/Elden-Ring/solitary-moon-slash.gif,Unique,Greatsword of Solitude,No,12 (-/10),"Sharply slash downward using the greatsword, shooting forward an arc of light. Strong attack allows for an advancing follow-up.",Default skill of Greatsword of Solitude,1
63,Revenge of the Night,https://eldenring.wiki.fextralife.com/file/Elden-Ring/revenge_of_the_night.gif,Unique,Shield of Night,No,5 (-/-),"Unleashes the dark of Night imbued with magic power. If used immediately after blocking an incoming attack, its power is absorbed, bolstering the strength of this skill.",Default skill of Shield of Night.,1
64,Weed Cutter,http://eldenring.wiki.fextralife.com/file/Elden-Ring/rakshasas-great-katana---weed-cutter.gif,Unique,Rakshasa's Great Katana,No,8 (-/8),"Performs scythe-like horizontal swings with the sword, cutting men down as if they were weeds. Additional inputs allow for the continuation of the attack for as long as stamina remains.",Default skill of Rakshasa's Great Katana.,1
65,Blindfold of Happiness,https://eldenring.wiki.fextralife.com/file/Elden-Ring/blindfold_of_happiness.gif,Unique,Lamenting Visage,No,10 (-/-),"Swing the head while covering the eyes, unleashing a wail of lamentation while temporarily making the user of this skill harder to see. To those who seek happiness, blindness is bliss.",Default skill of Lamenting Visage,1
66,Jori's Inquisition,https://eldenring.wiki.fextralife.com/file/Elden-Ring/joris_inquisition.gif,Unique,Barbed Staff-Spear,Yes,4 (-/-),"Thrust the greatstaff into the air, firing off a succession of golden barb-like arcs. Holding the button down extends the barrage for a short duration.",Default skill of the Barbed Staff-Spear,1
67,Roaring Bash,https://eldenring.wiki.fextralife.com/file/Elden-Ring/roaring_bash.gif,Unique,Golden Lion Shield,No,12 (-/-),Roar like a golden lion and deliver a shield bash from a guarding position. Knocks back and staggers foes over a wide radius.,Default skill of Golden Lion Shield,1
68,Deadly Poison Spray,https://eldenring.wiki.fextralife.com/file/Elden-Ring/deadly_poison_spray.gif,Unique,Deadly Poison Perfume Bottle,No,21 (-/-),"Swings the perfume bottle overhead, wafting perfumed powder of deadly poison over a wide area. Poison shall dance upon the air and pour down in quiet calm.",Default skill of the Deadly Poison Perfume Bottle,1
69,"Flare, O Serpent","http://eldenring.wiki.fextralife.com/file/Elden-Ring/flare,-o-serpent.gif",Unique,Serpent Flail,No,8 (-/-),"Ignites a flame inside the snakes, temporarily empowering flame attacks. Once ignited, strong attacks and other moves that strike the ground will cause an explosion.",Default skill of the Serpent Flail,1
70,Scattershot (Claws),https://eldenring.wiki.fextralife.com/file/Elden-Ring/scattershot-throw.gif,Unique,Claws of Night,No,11 (-/11),Employ smithing arts to conjure multiple copies of the claws in both hands and throw them all at once. Follow up with an additional input to throw again.,Default skill of Claws of Night,1
71,Hone Blade,https://eldenring.wiki.fextralife.com/file/Elden-Ring/hone_blade.gif,Unique,Bonny Butchering Knife,No,16 (-/-),"Perform a stroking action to sharpen blade, honing its cutting edge and increasing amount of HP recovered. The greater potentates treasure the tools of their practice.",Default skill of the Bonny Butchering Knife,1
