id,name,image,type,equipament,charge,FP,effect,locations,dlc
72,Horn Calling,http://eldenring.wiki.fextralife.com/file/Elden-Ring/horn-calling.gif,Unique,Horned Warrior's Sword,No,17 (-/-),"Invokes tangled horns to cover the weapon's blade. Drive the weapon into the ground, calling up a cluster of piercing horns.",Default skill of the Horned Warrior's Sword,1
73,Horn Calling: Storm,http://eldenring.wiki.fextralife.com/file/Elden-Ring/horn-calling-storm.gif,Unique,Horned Warrior's Greatsword,No,22 (-/10),"Invokes tangled horns to cover the weapon's blade. Call a storm into the horns, then mow through enemies. Additional inputs allow for up to two follow-up attacks",Default skill of the Horned Warrior's Greatsword,1
74,Tremendous Phalanx,https://eldenring.wiki.fextralife.com/file/Elden-Ring/tremendous_phalanx2_2.gif,Unique,Moonrithyll's Knights Sword,No,16 (-/6),"Skill of the enchanted troll knights. Creates a defensive arch of enormous magic glintblades overhead, which automatically attack nearby foes. Follow up with a strong attack to chain this skill into a lunging thrust.",Default skill of the Moonrithyll's Knights Sword,1
75,Bloodfiends' Bloodboon,https://eldenring.wiki.fextralife.com/file/Elden-Ring/bloodfiends_bloodboon.gif,Unique,Bloodfiend's Sacred Spear,No,20 (-/20),"Raise the sacred spear and pierce the body of the mother of truth, creating an explosion of bloodflame in the area surrounding the target. Additional input allows for up to three follow-up attacks.",Defaul skill of the Bloodfiend's Sacred Spear,1
76,Dragonform Flame,https://eldenring.wiki.fextralife.com/file/Elden-Ring/dragonform_flame.gif,Unique,Forked-Tongue Hatchet,No,14 (-/-),"Spew fire from a dragon-form maw, sweeping in a frontward arc. The flames on the ground will continue to burn for a short time.",Default skill of Forked-Tongue Hatchet,1
77,Lightspeed Slash,http://eldenring.wiki.fextralife.com/file/Elden-Ring/lightspeed-slash.gif,Unique,Greatsword of Radahn (Light),Yes,26 (-/-),Assume a luminous form and leap forward to deliver a downward slash at the speed of light. This attack will be followed up by an additional light attack. Charge to increase power of the skill and number of follow-up attacks.,Default skill of Greatsword of Radahn (Light),1
78,Rancor Shot,https://eldenring.wiki.fextralife.com/file/Elden-Ring/rancor_shot.gif,Unique,Bone Bow,No,-1,"Imbue arrows with vengeful spirits, before firing off a barrage. Imbued arrows chase down foes as they cut through the air.",Default skill of the Bone Bow,1
79,Stamp (Upward Cut),http://eldenring.wiki.fextralife.com/file/Elden-Ring/stamp_(upward_cut)_gif.gif,Regular,"Can be used on Swords, Axes, and Hammers, (small and medium swords excepted).",No,5 (-/8),Brace armament and step into a low stance that prevents recoil from most enemy attacks.Follow up with a strong attack for an upward strike.,"Default skill on the Zweihander.
Sold by Knight Bernahl at the Warmaster's Shack for 1,500 . Elden Ring Map Link.
Can be purchased from Twin Maiden Husks at the Roundtable Hold after giving them Bernahl's Bell Bearing.",0
80,Stamp (Sweep),http://eldenring.wiki.fextralife.com/file/Elden-Ring/stamp_(sweep)_gif.gif,Regular,"Can be used on Swords, Axes, and Hammers (small and medium swords excepted).",No,5 (-/8),Brace armament and step into a low stance that prevents recoil from most enemy attacks. Follow up with a strong attack for a sweeping strike.,"Dropped by an invisible Teardrop Scarab located at the beaches of Western Limgrave. From where the Giant Land Octopus and Land Octopus enemies are, check the east side of the shore and you'll see some pillars on the beach. You'll notice multiple glowing prints moving around the pillars. Attack it at the right time just when it's about to approach you to reveal the scarab. Elden Ring Map Link.",0
81,Wild Strikes,http://eldenring.wiki.fextralife.com/file/Elden-Ring/skill-wild-strikes-elden-ring-wiki-480px.gif,Regular,Can be used on Axes and Hammers as well as Curved Swords and Greatswords (colossal weapons excepted).,No,2 (10/15),Swing armament with wild abandon. Hold to continue swinging. Can be followed up with a normal or strong attack.,"Default skill on the Battle Axe.
Dropped from a Teardrop Scarab located in the middle of the path leading from the Stormhill Shack Site of Grace to the Castleward Tunnel Site of Grace. Elden Ring Map Link.",0
82,Lion's Claw,http://eldenring.wiki.fextralife.com/file/Elden-Ring/lion's_claw_gif_elden_ring_wiki_guide.gif,Regular,"Can be used on Swords, Axes, and Hammers (small armaments and Thrusting Swords excepted).",No,20,"Skill of the Redmanes, who fought alongside the General Radahn.Somersault forwards, striking foes with armament","Default skill on the Claymore.
Drops from the Lion Guardian in Fort Gael upon defeating it. Elden Ring Map Link.",0
83,Cragblade,http://eldenring.wiki.fextralife.com/file/Elden-Ring/cragblade.gif,Regular,Can be used on melee armaments (Whips excepted).,No,16,"Skill that manipulates gravity. Bury the armament in the ground, pulling rocks from the earth to reinforce it. Increases attack power and makes it easier to break enemy stance.","West of Impassable Greatbridge site, on a scarab in the sword monument. Elden Ring Map Link.",0
84,Kick,http://eldenring.wiki.fextralife.com/file/Elden-Ring/skill-kick-elden-ring-wiki-480px.gif,Regular,Can be used on all melee armaments.,No,-,"Push an enemy back with a high kick.Effective against enemies who are guarding, and can break a foe's stance.","Sold by Knight Bernahl at the Warmaster's Shack for 800 . Elden Ring Map Link.
Can be purchased from Twin Maiden Husks at the Roundtable Hold after giving them Bernahl's Bell Bearing.",0
85,Endure,http://eldenring.wiki.fextralife.com/file/Elden-Ring/endure.gif,Regular,Can be used on all melee armaments.,No,9,"Assume an anchored stance to brace for incoming attacks, briefly boosting poise. Damage taken while using this skill is reduced.","Default skill on the Dragon Greatclaw.
Sold by Knight Bernahl at the Warmaster's Shack for 600 . Elden Ring Map Link.
Can be purchased from Twin Maiden Husks at the Roundtable Hold after giving them Bernahl's Bell Bearing.",0
86,Ground Slam,http://eldenring.wiki.fextralife.com/file/Elden-Ring/ground_slam.gif,Regular,Can be used on all melee armaments.,No,14,Jump up high into the air and crash down on the ground ahead. The resulting pratfall sends a powerful shockwave in all directions.,Dropped by a Teardrop Scarab found rolling down the hill west of the Minor Erdtree in Mistwood. Elden Ring Map Link.,0
87,Earthshaker,http://eldenring.wiki.fextralife.com/file/Elden-Ring/earthshaker.gif,Regular,"Can be used Greataxes, Warhammers, and Colossal Weapons.",No,10 (-/5),"Thrust armament into the ground, then gather strength to unleash an earth-shaking shockwave. Follow up with a strong attack to swing the armament in a sweeping strike.","Can be obtained killing an invisible scarab on the road after Grand Lift of Dectus (found near a statue at the first intersection, you can hear it rolling and see a little cloud of dust moving).",0
88,Hoarah Loux's Earthshaker,http://eldenring.wiki.fextralife.com/file/Elden-Ring/hles.gif,Regular,Can be used on all melee armaments.,No,16 (-/16),"A skill where slamming both hands to the ground will unleash a shockwave, following up with another input will enable you to slam the ground again.",Trade Remembrance of Hoarah Loux with Enia at Roundtable Hold.,0
89,War Cry,http://eldenring.wiki.fextralife.com/file/Elden-Ring/war_cry_gif.gif,Regular,"Can be used on melee armaments (Daggers, Thrusting Swords, and Whips excepted).",No,16,"Give a war cry to rally the spirit and increase attack power.While active, strong attacks change to charging attacks.","Default skill on the Highland Axe.
Sold by Knight Bernahl at the Warmaster's Shack for 800 . Elden Ring Map Link.
Can be purchased from Twin Maiden Husks at the Roundtable Hold after giving them Bernahl's Bell Bearing.",0
90,Barbaric Roar,http://eldenring.wiki.fextralife.com/file/Elden-Ring/skill-barbaric-roar-elden-ring-wiki-480px.gif,Regular,"Can be used on melee armaments (Daggers, Thrusting Swords, and Whips excepted).",No,16,"Let loose a bestial roar to rally the spirit and increase attack power. While active, strong attacks change to savage combo attacks.","Default skill on the Club.
On a Teardrop Beetle in Ravine-Veiled Village, found by going as far northeast as possible in Lake of Liurnia (near but not accessible from Grand Lift of Dectus).",0
91,Braggart's Roar,http://eldenring.wiki.fextralife.com/file/Elden-Ring/braggart_roar.gif,Regular,"Can be used on melee armaments (Daggers, Thrusting Swords, and Whips excepted).",No,16,"Declare your presence with a boastful roar. Raises attack power, defense and stamina recover speed.",Default skill on the Battle Hammer.,0
92,Troll's Roar,http://eldenring.wiki.fextralife.com/file/Elden-Ring/skill-trolls-roar-elden-ring-wiki-480px.gif,Regular,"Can be used on large and Colossal Swords, Axes, and Hammers.",No,22,"Look into the distance and let out an intense roar, generating a powerful shockwave that blows back surrounding foes. Follow up with a strong attack to slam the armament down.","Default skill on the Troll's Hammer.
Can be found on the top of the big rock just south east the Church of Repose (in Mountaintops of the Giants).",0
93,Spinning Slash,http://eldenring.wiki.fextralife.com/file/Elden-Ring/skill-spinning-slash-elden-ring-wiki-480px.gif,Regular,"Can be used on Swords, Axes, and Polearms (colossal weapons excepted).",No,6 (-/12),Skill favored by dexterous warriors. Slash foes as your body spins. Additional input allows for a follow-up attack.,"Default skill of the Scimitar.
Default skill of the Twinblade.
Default skill of the Gargoyle's Black Halberd.
Sold by Knight Bernahl at the Warmaster's Shack for 1,200 . Elden Ring Map Link.
Can be purchased from Twin Maiden Husks at the Roundtable Hold after giving them Bernahl's Bell Bearing.",0
94,Impaling Thrust,http://eldenring.wiki.fextralife.com/file/Elden-Ring/impaling_thrust_gif.gif,Regular,Can be used on armaments capable of thrusting (colossal weapons excepted).,No,9,"Skill that lets piercing armaments overcome enemy shields. Build power, then lunge forward for a long thrust that pierces an enemy's guard.","Default skill on the Short Spear, Katar, Partisan and Estoc.
Sold by Knight Bernahl at the Warmaster's Shack for 1,000 . Elden Ring Map Link.
Can be purchased from Twin Maiden Husks at the Roundtable Hold after giving them Bernahl's Bell Bearing.",0
95,Piercing Fang,http://eldenring.wiki.fextralife.com/file/Elden-Ring/skill-piercing-fang-elden-ring-wiki-480px.gif,Regular,Can be used on medium and large armaments capable of thrusting.,No,16,"Skill used by Yura, the Bloody Finger Hunter. Starting with the blade held horizontally, make a powerful thrust that cannot be blocked.",Can be acquired from Bloody Finger Hunter Yura. Elden Ring Map Link.,0
96,Repeating Thrust,http://eldenring.wiki.fextralife.com/file/Elden-Ring/skill-repeating-thrust-elden-ring-wiki-480px.gif,Regular,Can be used on all thrusting weapons. (Colossal Weapons excepted).,No,7,"Twist to build power, then unleash a flurry of thrusts.","Found inside a chest, underground of Gatefront Ruins in Limgrave. You'll find the stairs that goes down at the center part of the Gatefront Ruins. Elden Ring Map Link.
Default skill for the Scorpion's Stinger.",0
97,Double Slash,http://eldenring.wiki.fextralife.com/file/Elden-Ring/double_slash.gif,Regular,Can be used on swords and polearms capable of slashing (colossal weapons excepted).,No,6 (-/3),Skill of superior swordsmen. Perform a crossing slash attack from a low stance. Repeated inputs allow for up to two follow-up attacks.,"Found in Sellia, Town of Sorcery: Dropped by a Teardrop Scarab found high above on a very large root in the western end of town. Accessible by jumping across the rooftops. Elden Ring Map Link.",0
98,Sword Dance,http://eldenring.wiki.fextralife.com/file/Elden-Ring/sword_dance.gif,Regular,"Can be used on Swords, Axes, and Polearms capable of slashing (colossal weapons and great spears excepted).",No,6 (-/6),Quickly close in to perform a series of spinning upward slashes. Follow up with an additional input to finish with a downward slash.,Dropped by a Teardrop Scarab found near the Minor Erdtree in southwest Liurnia. Elden Ring Map Link.,0
99,Unsheathe,http://eldenring.wiki.fextralife.com/file/Elden-Ring/skill-unsheathe-elden-ring-wiki-480px.gif,Regular,Can be used on Katanas.,No,-0.666666667,"Skill of swordsmen from the Land of Reeds. Sheathe blade, holding it at the hip in a composed stance. Follow up with a normal or strong attack to perform a swift slash attack.","Dropped by a Teardrop Scarab in the water in the South East portion of Agheel Lake, North West of the Agheel Lake South Site of Grace. Elden Ring Map Link.",0
100,Quickstep,http://eldenring.wiki.fextralife.com/file/Elden-Ring/skill-quickstep-elden-ring-wiki-480px.gif,Regular,Can be used on all melee armaments.,No,3,Skill prized by the crafty and fleet of foot. Perform a quickstep maneuver that allows for circling around lock-on targets.,"Default skill on the Great Knife & Forked Hatchet.
Sold by Knight Bernahl at the Warmaster's Shack for 800 . Elden Ring Map Link.
Can be purchased from Twin Maiden Husks at the Roundtable Hold after giving them Bernahl's Bell Bearing.",0
101,Bloodhound's Step,http://eldenring.wiki.fextralife.com/file/Elden-Ring/bhs.gif,Regular,Can be used on all melee armaments.,No,5,Skill that allows the user to become temporarily invisible while dodging at high speed. Moves faster and travels farther than a regular quickstep. This skill can be used to circle around lock-on targets.,"Dropped by a Night's Cavalry at the bridge in front of the Lenne's Rise tower, in Dragonbarrow.",0
102,Raptor of the Mists,http://eldenring.wiki.fextralife.com/file/Elden-Ring/raptor_of_the_mists_gif_elden_ring_wiki_guide.gif,Regular,Can be used on all melee armaments,No,6,"Duck into a low stance, momentarily vanishing. If an enemy attack connects, avian wings will allow for a quick escape into the air",Found after aiding Bloody Finger Hunter Yura in defeating his target in Raya Lucaria.,0
103,Beast's Roar,http://eldenring.wiki.fextralife.com/file/Elden-Ring/beast's_roar_gif_elden_ring_wiki_guide.gif,Regular,Can be used on all melee armaments.,No,10,"Unleash a beastly roar, rending the air as a forward-traveling projectile.","Bestial Sanctum: Reward from Gurranq, Beast Clergyman after giving him the fourth Deathroot. Elden Ring Map Link.",0
104,Square Off,http://eldenring.wiki.fextralife.com/file/Elden-Ring/skill-square-off-elden-ring-wiki-480px.gif,Regular,Can be used on Straight Swords.,No,-0.75,"Slash up through enemy guards with a normal attack, or run and thrust with a strong attack.","Default skill of the Longsword.
Dropped by a Teardrop Scarab found rolling around at the edge a the cliff in Siofra River. Elden Ring Map Link.",0
105,Charge Forth,http://eldenring.wiki.fextralife.com/file/Elden-Ring/skill-charge-forth-elden-ring-wiki-480px.gif,Regular,"Can be used on Polearms capable of thrusting, Heavy Thrusting Swords, and Twinblades.",No,16,"Quickly charge forward with the armament at the hip, carrying the momentum into a thrust. Hold to cover a greater distance","Default skill of the Golem's Halberd
Default skill of the Lance.
Dropped by a Teardrop Scarab that is attached to a ceiling under some Poison Pod enemies. Elden Ring Map Link.",0
106,Spinning Strikes,http://eldenring.wiki.fextralife.com/file/Elden-Ring/spinning_strikes_gif_elden_ring_wiki_guide.gif,Regular,Can be used on Polearms (Great Spears excepted).,??,2 (10/15),Polearm skill that performs continuous spinning attacks. Hold to continue the attack. Can be followed up with a normal or strong attack. Nullifies projectiles such as arrows while spinning.,"After completing Irina's questline, Edgar will invade at the Revenger's Shack where he upon death will drop aBanished Knight's Halberd +8 with the Spinning Strikes Ash of War attached. The ash of war can be extracted from the weapon.",0
107,Giant Hunt,http://eldenring.wiki.fextralife.com/file/Elden-Ring/giant_hunt.gif,Regular,"Can be used on large and colossal weapons capable of thrusting, Spears and Twinblades.",No,16,"Skill developed for confronting gigantic foes. Step forward from a low stance, carrying the momentum into a sudden upward thrust.","Dropped by the lone wandering Troll Knight. Elden Ring Map Link.
Dropped by miniboss Night's Cavalry. Only appears at night. Elden Ring Map Link.",0
108,Storm Blade,http://eldenring.wiki.fextralife.com/file/Elden-Ring/storm_blade_gif_elden_ring_wiki_guide.gif,Regular,Can be used Swords (Colossal Weapons and Twinblades excepted),No,10 (-/6),Lost skill of Stormveil. Surround armament with shearing storm winds that can be fired forward. Can be fired in rapid succession.,"Dropped by Grave Warden in Murkwater Catacombs, Limgrave.
Sold by Knight Bernahl at the Warmaster's Shack for 1,800 . Elden Ring Map Link.
Can be purchased from Twin Maiden Husks at the Roundtable Hold after giving them Bernahl's Bell Bearing.",0
109,Storm Assault,http://eldenring.wiki.fextralife.com/file/Elden-Ring/storm_assault_gif_elden_ring_wiki_guide.gif,Regular,"Can be used on Polearms capable of thrusting, heavy thrusting swords, and Twinblades.",??,22,One of the skills that channel the tempests of Stormveil. Leap forward through surrounding storm winds and thrust armament downward. The attack will produce more storm winds at the point of impact.,Dropped by a Silver Teardrop Scarab in Stormveil Castle.,0
110,Stormcaller,http://eldenring.wiki.fextralife.com/file/Elden-Ring/stormcaller_gif_elden_ring_wiki_guide.gif,Regular,"Can be used on Swords capable of slashing, Axes, Hammers, and polearms (small and colossal weapons excepted).",??,9 (-/11),One of the skills that channel the tempests of Stormveil. Spin armament to create surrounding storm winds. Repeated inputs allow for up to two follow-up attacks.,"Dropped by a Teardrop Scarab in the northern section of the castle, past the courtyard and just before the Secluded Cell Site of Grace in Stormveil Castle. Elden Ring Map Link.",0
111,Storm Stomp,http://eldenring.wiki.fextralife.com/file/Elden-Ring/storm-stomp-skill-elden-ring-wiki-guide.jpg,Regular,All melee armaments.,No,6,One of the skills that channel the tempests of Stormveil. Stomp hard on the ground to kick up a momentary storm.,"Found in Stormveil Castle, at the very end of the accessible area before a barricade blocks further progress up the staircase guarded by ballistas with 3 soldiers at the top.
Found in the southeastern area of Gatefront Ruins. There is a set of stairs that leads to a small room underground where a treasure chest can be found. Inside the chest is the Ash of War: Storm Stomp and Whetstone Knife key item. Elden Ring Map Link.",0
112,Vacuum Slice,http://eldenring.wiki.fextralife.com/file/Elden-Ring/skill-vacuum-slice-elden-ring-wiki-480px.gif,Regular,Can be used on Swords and Axes (small and colossal axes excepted).,No,18,"Lost skill of ancient heroes. Hold the armament aloft to surround it with a shearin vacuum, then launch it forwards as a blade-like projectile.","Default skill on the Gargoyle's Greatsword.
Inside the ruined temple surrounded by waterfalls in Deeproot Depths. Elden Ring Map Link.",0
113,Phantom Slash,http://eldenring.wiki.fextralife.com/file/Elden-Ring/phantom_slash_gif_elden_ring_wiki_guide.gif,Regular,Can be used on Polearms and Twinblades (Great Spears excepted).,No,8 (-/8),Skill inspired by the fond remembrances of the Night's Cavalry. Creates an apparition of the knights' former instructor who guides a joint lunging upward swing. Additional input allows for a follow-up attack.,Dropped by a Night's Cavalry northeast the Forbidden Lands Grace in the Forbidden Lands. Elden Ring Map Link.,0
114,Determination,http://eldenring.wiki.fextralife.com/file/Elden-Ring/determination_gif_elden_ring_wiki_guide.gif,Regular,Can be used on all melee armaments.,No,10,"Hold the flat of the armament to your face and pledge your resolve, powering up your next attack.",Dropped by a Teardrop Scarab on the path at the bridge north of Agheel Lake. Elden Ring Map Link.,0
115,Royal Knight's Resolve,http://eldenring.wiki.fextralife.com/file/Elden-Ring/royal_knight's_resolve_gif_elden_ring_wiki_guide.gif,Regular,Can be used on all melee armaments.,No,15,"Skill of the knights who once served the Elden Lord. Hold the flat of the armament to your face and pledge your resolve, greatly powering up your next attack.","Continue going through the Volcano Manor Legacy Dungeon until you see a chapel full of Lizards, you'll then see an Imp Statue Dungeon you can enter at the balcony. From there, you will have to jump down carefully until you reach the bottom. Then enter the room on the east side, then pillage the corpse to acquire the ash of war.",0
116,Glintstone Pebble,http://eldenring.wiki.fextralife.com/file/Elden-Ring/skill-glintstone-pebble-elden-ring-wiki-480px.gif,Regular,Can be used on Swords and Polearms capable of thrusting (colossal weapons excepted).,No,8 (-/4),"Skill that employs the glintstone sorcery of the same name. Follow up with a strong attack to chain this skill into a lunging thrust, performed while the armament is still imbued with glintstone.","Sold by Sorcerer Rogier at Stormveil Castle or the Roundtable Hold for 1,500 .
Can be purchased from Twin Maiden Husks at the Roundtable Hold after giving them Rogier's Bell Bearing.",0
117,Glintblade Phalanx,http://eldenring.wiki.fextralife.com/file/Elden-Ring/gbp.gif,Regular,Usable on Swords as well as Polearms capable of thrusting (colossal weapons excepted),No,10 (-/4),"Skill used by the enchanted knights who served the Carian royal family. Form an arch of magic glintblades overhead, which will attack foes automatically. Follow up with a strong attack to chain this skill into a lunging thrust.","Acquired from Rogier's Rapier.
After defeating Godrick the Grafted in Stormveil Castle, Rogier can be found in Roundtable Hold, by the balcony. After speaking to him, and receiving his rapier, the skill may be removed from the rapier in order to be applied to other armaments.",0
118,Carian Greatsword Skill,http://eldenring.wiki.fextralife.com/file/Elden-Ring/skill-carian-greatsword-elden-ring-wiki-480px.gif,Regular,Can be used on Swords (colossal weapons excepted),Yes,16,Carian royal prestige embodied in a skill. Transform blade into a magical greatsword and swing it down. Can be charged to increase its power.,"Sold by Sorcerer Rogier at Stormveil Castle or the Roundtable Hold for 2,500 .
Can be purchased from Twin Maiden Husks at the Roundtable Hold after giving them Rogier's Bell Bearing.",0
119,Carian Grandeur,http://eldenring.wiki.fextralife.com/file/Elden-Ring/skill-carian-grandeur-elden-ring-wiki-480px.gif,Regular,Can be used on Swords (colossal weapons excepted).,Yes,26,Carian royal prestige embodied in a skill. Transform blade into magical greatsword and swing ti down. Can be charged to increase its power by up to two levels.,"Default skill on the Carian Knight's Sword.
Located within Caria Manor, high above a large stone structure. This is accessible by climbing down the cliffside graveyard from the manor's upper level.  Elden Ring Map Link.",0
120,Spinning Weapon,http://eldenring.wiki.fextralife.com/file/Elden-Ring/skill-spinning-weapon-elden-ring-wiki-480px.gif,Regular,"Small and medium Swords, Axes, Hammers, Polearms, Staves (great spears excepted)",No,12,"Defensive skill employed by Carian princesses. Lifts armament into mid-air, then makes it spin violently. Those it touches will suffer successive attacks.","Default skill on the Carian Regal Scepter.
Sold by Sorcerer Rogier at Stormveil Castle or the Roundtable Hold for 1,000 .
Can be purchased from Twin Maiden Husks at the Roundtable Hold after giving them Rogier's Bell Bearing.",0
121,Loretta's Slash,http://eldenring.wiki.fextralife.com/file/Elden-Ring/skill-lorettas-slash-elden-ring-wiki-480px.gif,Regular,Can be used on Polearms and Twinblades.,No,14,"Skill of Loretta the Royal Knight. Leap forward, imbuing the blade with glintstone, then descend, accelerating into a sweeping slash.",Dropped by Royal Knight Loretta upon defeat in Caria Manor. Elden Ring Map Link.,0
122,Waves of Darkness,http://eldenring.wiki.fextralife.com/file/Elden-Ring/waves_of_darkness_gif_elden_ring_wiki_guide.gif,Regular,"Can be used on Greataxes, Warhammers, and Colossal Weapons.",No,16 (-/5),Plunge armament into the ground to release three waves of darkness. Follow up with a strong attack to swing the armament in a sweeping strike.,Trade Remembrance of the Naturalborn with Enia at Roundtable Hold.,0
123,Gravitas,http://eldenring.wiki.fextralife.com/file/Elden-Ring/skill-gravitas-elden-ring-wiki-480px.gif,Regular,Melee armaments that are not small.,No,13,"Skill originating from the Alabaster Lords, who had skin of stone. Thrust the armament into the ground to create a gravity well. In addition to dealing damage, this attack pulls enemies in.",Obtained in Limgrave by accessing the back entrance of the Cave of Knowledge from the beachside. Elden Ring Map Link.,0
124,Flaming Strike,http://eldenring.wiki.fextralife.com/file/Elden-Ring/flaming_strike.gif,Regular,Can be used on melee armaments (Colossal Weapons and Whips excepted).,No,4 (-/10),"Skill that emits flame in a wide frontward arc. Follow up with a strong attack to perform a lunging, sweeping strike. This will also coat the armament in fire.",Dropped by a Teardrop Scarab located in a small graveyard along the south cliffside behind Redmane Castle.,0
