id,name,image,type,equipament,charge,FP,effect,locations,dlc
184,Rallying Standard,http://eldenring.wiki.fextralife.com/file/Elden-Ring/skill-rallying-standard-elden-ring-wiki-480px.gif,Unique,Commander's Standard,No,30,Hoist the war banner aloft and give a rallying command. Raises attack power and defense for self and nearby allies.,Default skill on the Commander's Standard.,0
185,Bear Witness!,http://eldenring.wiki.fextralife.com/file/Elden-Ring/skill-bear-witness-elden-ring-wiki-480px.gif,Unique,Grafted Dragon,No,20,"Grant the small dragon a fleeting glimpse of life and thrust it skyward, spewing flames over a wide frontward area.",Default skill on the Grafted Dragon.,0
186,Eochaid's Dancing Blade,http://eldenring.wiki.fextralife.com/file/Elden-Ring/skill-eochaids-dancing-blade-elden-ring-wiki-480px.gif,Unique,Marais Executioner's Sword Regalia of Eochaid,Yes,15,"Infuse the sword with energy, then fling it forwards in a corkscrew attack. The sword continuously deals damage while violently spinning. Charge the attack to increase reach and duration of the spin.","Default skill of the Marais Executioner's Sword.
Default skill on the Regalia of Eochaid.",0
187,Soul Stifler,http://eldenring.wiki.fextralife.com/file/Elden-Ring/soul_stifler_gif.gif,Unique,Winged Greathorn,??,12,Raise the greathorn's wings to summon a soul-sapping miasma. Enemies in the affected area will temporarily suffer from reduced defense.,Default skill on the Winged Greathorn.,0
188,Taker's Flames,http://eldenring.wiki.fextralife.com/file/Elden-Ring/skill-takers-flames-elden-ring-wiki-480px.gif,Unique,Blasphemous Blade,No,30,"Raise the sacred sword aloft to set it ablaze with blasphemous flames, then bring it down to fire off a forward blast.The flames steal HP from those they touch.",Default skill on the Blasphemous Blade.,0
189,Shriek of Milos,http://eldenring.wiki.fextralife.com/file/Elden-Ring/skill-shriek-of-milos-elden-ring-wiki-480px.gif,Unique,Sword of Milos,No,30,"Lets out a horrific cursed scream that reduces all damage negation and status resistances for nearby foes.While active, strong attacks will change to a combo attack.",Default skill on the Sword of Milos.,0
190,Reduvia Blood Blade,http://eldenring.wiki.fextralife.com/file/Elden-Ring/skill-reduvia-blood-blade-elden-ring-wiki-480px.gif,Unique,Reduvia dagger,No,6,"Slash with the wicked dagger, transforming its never-drying bloostains into airborne blood blades that cause hemorrhaging. Can be fired in rapid succession.",Defaul skill on the Reduvia dagger.,0
191,Glintstone Dart,http://eldenring.wiki.fextralife.com/file/Elden-Ring/skill-glintstone-dart-elden-ring-wiki-480px.gif,Unique,Glintstone Kris,Yes,10,Skill that builds from the Glintstone Pebble sorcery. Charge the skill to upgrade it to Glintstone Dart. Follow up with a strong attack to chain this skill into a lunging thrust.,Default skill on the Glintstone Kris Dagger.,0
192,Night-and-Flame Stance,http://eldenring.wiki.fextralife.com/file/Elden-Ring/skill-night-and-flame-stance-elden-ring-wiki-480px.gif,Unique,Sword of Night and Flame,No,- (19 23),"Hold the sword level and prepare to cast a sorcery. Follow up with a normal attack to cast the Night Comet sorcery, or a strong attack to sweep forward with a burst of flames.",Default skill on the Sword of Night and Flame.,0
193,Wave of Gold,http://eldenring.wiki.fextralife.com/file/Elden-Ring/wave-of-gold.gif,Unique,Sacred Relic Sword,No,50,"Imbue the sword with bygone golden glory, then fire it at foes.A wide, golden wave fans out forwards, sweeping through all enemies caught in its path.",Default skill on the Sacred Relic Sword.,0
194,Ruinous Ghostflame,http://eldenring.wiki.fextralife.com/file/Elden-Ring/skill-ruinous-ghostflame-elden-ring-wiki-480px.gif,Unique,Helphen's Steeple,No,20,"Swing the sword to bathe its blade in ghostflame. The ghostflame adds magic damage to attacks, and also has a bitterly cold bite.",Default skill on the Helphen's Steeple.,0
195,Establish Order,http://eldenring.wiki.fextralife.com/file/Elden-Ring/skill-establish-order-elden-ring-wiki-480px.gif,Unique,Golden Order Greatsword,No,20,"Raise the armament in a salute, releasing a golden explosion. Repeated inputs send out waves of golden light.",Default skill on the Golden Order Greatsword.,0
196,Mists of Slumber,http://eldenring.wiki.fextralife.com/file/Elden-Ring/skill-mists-of-slumber-elden-ring-wiki-480px.gif,Unique,Sword of St Trina,No,30,Releases a faint purple mist that spreads across a wide frontwards area.This mist inflicts the sleep ailment upon foes.,Default skill for the Sword of St Trina.,0
197,Spearcall Ritual,http://eldenring.wiki.fextralife.com/file/Elden-Ring/skill-spearcall-ritual-elden-ring-wiki-480px.gif,Unique,Death Ritual Spear,No,20,"Thrust the spear high, bearing prayers into the sky to summon a downpour of spectral spears.",Default skill on the Death Ritual Spear.,0
198,Wolf's Assault,http://eldenring.wiki.fextralife.com/file/Elden-Ring/skill-wolfs-assault-elden-ring-wiki-480px.gif,Unique,Royal Greatsword,No,20,"Infuse the greatsword with frost, then perform a forward somersault to plunge it into the ground. Then, pull it out to release a cold blast.",Default skill on the Royal Greatsword.,0
199,Thundercloud Form,http://eldenring.wiki.fextralife.com/file/Elden-Ring/skill-thundercloud-form-elden-ring-wiki-480px.gif,Unique,Dragon King's Cragblade,Yes,35,"Temporarily transform into a red thundercloud and fly through the air, then plunge down with a lightning-infused blade. Hold to increase the reach of the thundercloud form.",Default skill for the Dragon King's Cragblade.,0
200,Cursed-Blood Slice,http://eldenring.wiki.fextralife.com/file/Elden-Ring/skill-cursed-blood-slice-elden-ring-wiki-480px.gif,Unique,Morgott's Cursed Sword,No,20 (- 20),"Brace, then charge forward to deliver a downward diagonal slice. The bloody trail of the late is followed by a burst of flame. Additional input allows for a follow-up attack.",Default skill on the Morgott's Cursed Sword.,0
201,Waterfowl Dance,http://eldenring.wiki.fextralife.com/file/Elden-Ring/skill-waterfowl-dance-elden-ring-wiki-480px.gif,Unique,Hand of Malenia,No,12,Perform a series of one-footed leaps in the manner of a waterfowl to unleash a swift yet graceful slashing combo.Repeated inputs allow for up to two follow-up attacks.,Default skill on the Hand of Malenia.,0
202,Gold Breaker,http://eldenring.wiki.fextralife.com/file/Elden-Ring/skill-gold-breaker-elden-ring-wiki-480px.gif,Unique,Marika's Hammer,No,31,"Leap up high and, while suspended in midair, imbue the rune shard with light before smashing it down hard onto the ground.The heroic Radagon's signature attack.",Default skill on the Marika's Hammer.,0
203,"I Command Thee, Kneel!",http://eldenring.wiki.fextralife.com/file/Elden-Ring/skill-i-command-thee-kneel-elden-ring-wiki-480px.gif,Unique,Axe of Godrick,No,15,"Repeatedly smash the Axe of Godrick into the ground, unleashing two earth-shaking shockwaves.Follow up with an additional input to produce a third shockwave",This Skill can only be acquired by equipping Axe of Godrick.,0
204,Regal Roar,http://eldenring.wiki.fextralife.com/file/Elden-Ring/skill-regal-roar-elden-ring-wiki-480px.gif,Unique,Axe of Godfrey,No,25,"Let loose a mighty war cry, raising attack power, while sending out a shockwave that cannot be guarded against by stomping the ground. While active, strong attack becomes a lunging slash.",Default skill on the Axe of Godfrey.,0
205,Starcaller Cry,http://eldenring.wiki.fextralife.com/file/Elden-Ring/starcaller_cry_gif.gif,Unique,Starscourge Greatsword,??,20 (-20),"Bring the two swords together and roar into the skies, pulling in enemies with a gravitational wave. Follow up with an additional input to slam down with gravity-infused swords.",Default skill of the Starscourge Greatsword.,0
206,Wave of Destruction,http://eldenring.wiki.fextralife.com/file/Elden-Ring/skill-wave-of-destruction-elden-ring-wiki-480px.gif,Unique,Ruins Greatsword,No,25,"Raise the sword up high, then strike it against the ground to fire off a wave of gravitational force.",Default skill on the Ruins Greatsword.,0
207,Bloodboon Ritual,http://eldenring.wiki.fextralife.com/file/Elden-Ring/main_large2.gif,Unique,Mohgwyn's Sacred Spear,No,20 (-20),"Raise the sacred spear and pierce the body of the Formless Mother. Stab up to three times, creating explosions of blood with each thrust.This skill will coat the armament with bloodflame for a while.",Default skill on the Mohgwyn's Sacred Spear.,0
208,Flowing Form,http://eldenring.wiki.fextralife.com/file/Elden-Ring/skill-flowing-form-sword-elden-ring-wiki-480px.gif,Unique,Nox Flowing Sword,No,9,Temporarily transforms armament into its liquid form.Swing the armament like a whip to perform a sweeping slice over a wide area.,Default skill of the Nox Flowing Sword.,0
209,Flowing Form,http://eldenring.wiki.fextralife.com/file/Elden-Ring/skill-flowing-form-hammer-elden-ring-wiki-480px.gif,Unique,Nox Flowing Hammer,No,16,Temporarily transforms armament into its liquid form.Swing the armament like a whip to strike surroundings before slamming its teardrop-shaped head down.,Default skill of the Nox Flowing Hammer.,0
210,Blade of Death,http://eldenring.wiki.fextralife.com/file/Elden-Ring/skill-blade-of-death-elden-ring-wiki-480px.gif,Unique,Black Knife,No,25,"Unleash the power of the Rune of Death to fire off a blade-like projectile.In addition to dealing immediate damage, the blade reduces the enemy's maximum HP and continues to wear down HP for a while.",Default skill on the Black Knife.,0
211,Blade of Gold,http://eldenring.wiki.fextralife.com/file/Elden-Ring/skill-blade-of-gold-elden-ring-wiki-480px.gif,Unique,Blade of Calling,No,20,"Leap into the air, charging the armament with golden flames that are then shot at the enemy as a single, blade-like projectile. Inflicts holy damage.",Default skill on the Blade of Calling.,0
212,Destined Death,http://eldenring.wiki.fextralife.com/file/Elden-Ring/dfd4ad5a-7d23-4f0c-8e81-06bb2bbdd0cd.gif,Unique,Maliketh's Black Blade,No,40,"Set free the remnants of Destined Death, plunging the greatsword into the ground to summon a myriad of blades. In addition to dealing immediate damage, this attack reduces the enemy's maximum HP and continues to wear down HP for a short time.",Default skill on the Maliketh's Black Blade.,0
213,Spinning Wheel,http://eldenring.wiki.fextralife.com/file/Elden-Ring/skill-spinning-wheel-elden-ring-wiki-480px.gif,Unique,Ghiza's Wheel,No,3,Strike the wheel against the ground to set it spinning at top speed. Hold to keep the wheel spinning. Can be used while walking to push the armament into enemies.,Default skill on the Ghiza's Wheel.,0
214,Alabaster Lord's Pull,http://eldenring.wiki.fextralife.com/file/Elden-Ring/skill-alabaster-lords-pull-elden-ring-wiki-480px.gif,Unique,Alabaster Lord's Sword,No,15,"Thrust the armament into the ground to create a gravity well. In addition to dealing damage, this attack pulls enemies in. Has a greater area of effect than Gravitas.",Default skill on the Alabaster Lord's Sword.,0
215,Onyx Lord's Repulsion,http://eldenring.wiki.fextralife.com/file/Elden-Ring/skill-onyx-lords-repulsion-elden-ring-wiki-480px.gif,Unique,Onyx Lord's Greatsword,No,27,"Thrust the armament into the ground to create a gravity well. In addition to dealing damage, this attack sends enemies flying away.",Default skill on the Onyx Lord's Greatsword.,0
216,Oath of Vengeance,http://eldenring.wiki.fextralife.com/file/Elden-Ring/oath_of_vengeance_gif.gif,Unique,Grafted Blade Greatsword,??,20,"Swear an oath upon the greatsword to avenge the clan, temporarily raising all attributes for a certain duration. While the oath's effects are active, poise will also be increased.",Default skill on the Grafted Blade Greatsword.,0
217,Ice Lightning Sword,http://eldenring.wiki.fextralife.com/file/Elden-Ring/skill-ice-lightning-sword-elden-ring-wiki-480px.gif,Unique,Dragonscale Blade,No,25,Call down a bolt of ice lightning into the blade and bring it down upon a foe.The ice lightning effect will persist for a while.,Default skill on the Dragonscale Blade.,0
218,Regal Beastclaw,http://eldenring.wiki.fextralife.com/file/Elden-Ring/skill-regal-beastclaw-elden-ring-wiki-480px.gif,Unique,Beastclaw Greathammer,No,20,"Slam the hammer into the ground, rending the land asunder with the armament's five bestial claws.",Default skill on the Beastclaw Greathammer.,0
219,Flame Dance,http://eldenring.wiki.fextralife.com/file/Elden-Ring/skill-flame-dance-elden-ring-wiki-480px.gif,Unique,Giant's Red Braid,No,25,Imbue the red braid with the Giants' Flame and lash out in a wide range with a series of agile swings.,Default skill for the Giant's Red Braid.,0
220,Claw Flick,http://eldenring.wiki.fextralife.com/file/Elden-Ring/skill-claw-flick-elden-ring-wiki-480px.gif,Unique,Ringed Finger,No,14,"Cause the finger to swell, then flex to build up strength before giving enemies an almighty flick.",Default skill on the Ringed Finger.,0
221,Nebula,http://eldenring.wiki.fextralife.com/file/Elden-Ring/skill-nebula-sword-elden-ring-wiki-480px.gif,Unique,Bastard's StarsWing of Astel,No,25,Imbue the Naturalborn's stars with magic to perform a sweeping strike.This attack leaves a dark cloud of stars in its wake that lingers briefly before exploding.,"Default skill on the Bastard's Stars.
Defeult skill on the Wing of Astel.",0
222,Ghostflame Ignition,http://eldenring.wiki.fextralife.com/file/Elden-Ring/skill-ghostflame-ignition-elden-ring-wiki-480px.gif,Unique,Death's Poker,No,15,"Thrust out the barbed rod and set its tip alight with ghostflame.Follow up with a normal attack to set the ground ablaze with ghostflame, or a strong attack to trigger a massive explosion.",Default skill on the Death's Poker.,0
223,Ancient Lightning Spear,http://eldenring.wiki.fextralife.com/file/Elden-Ring/skill-ancient-lightning-spear-elden-ring-wiki-480px.gif,Unique,Bolt of Gransax,Yes,35,"Imbue the armament with the ancient dragons' red lightning, then throw it as a spear. Can be charged to increase its power.",Default skill on the Bolt of Gransax.,0
224,Frenzyflame Thrust,http://eldenring.wiki.fextralife.com/file/Elden-Ring/skill-frenzyflame-thrust-elden-ring-wiki-480px.gif,Unique,Vyke's War Spear,No,22,"Imbue the spear with the flame of frenzy and leap forwards, plunging it into the ground and setting off a maddening explosion. The skill inflicts both the enemy and the user with madness.",Default skill on Vyke's War Spear.,0
225,Miquella's Ring of Light,http://eldenring.wiki.fextralife.com/file/Elden-Ring/skill-miquellas-ring-of-light-elden-ring-wiki-480px.gif,Unique,Halo Scythe,No,11,Summon Miquella's shining halo and fire it forwards. Can be fired in rapid succession.,Default skill on the Halo Scythe.,0
226,Golden Tempering,http://eldenring.wiki.fextralife.com/file/Elden-Ring/skill-golden-tempering-elden-ring-wiki-480px.gif,Unique,Ornamental Straight Sword,No,30,"Cross the two swords to grant their attacks holy essence.While in effect, strong attack performs a dual-wielding combo attack.",Default skill on the Ornamental Straight Sword.,0
227,Last Rites,http://eldenring.wiki.fextralife.com/file/Elden-Ring/skill-last-rites-elden-ring-wiki-480px.gif,Unique,Golden Epitaph,No,25,Raise the epitaph to grant the effect of Sacred Order to yourselfand allies in the vicinity.Particularly effective at laying to rest Those Who Live in Death.,Default skill on the Golden Epitaph.,0
228,Unblockable Blade,http://eldenring.wiki.fextralife.com/file/Elden-Ring/skill-unblockable-blade-sword-elden-ring-wiki-480px.gif,Unique,Cipher Pata Coded Sword,No,25,"Imbue the cipher blade with light, extending its length, then strike with a sudden sweeping attack.This attack cannot be blocked.","Default skill on the Cipher Pata.
Default skill on the Coded Sword.",0
229,Corpse Wax Cutter,http://eldenring.wiki.fextralife.com/file/Elden-Ring/skill-corpse-wax-cutter-elden-ring-wiki-480px.gif,Unique,Gargoyle's Blackblade,No,20,Lost skill of ancient heroes.Lift the sword up high to release the power of corpse wax and launch it forwards as a blade-like projectile.,Default skill on the Gargoyle's Blackblade.,0
230,Zamor Ice Storm,http://eldenring.wiki.fextralife.com/file/Elden-Ring/skill-zamor-ice-storm-elden-ring-wiki-480px.gif,Unique,Zamor Curved Sword,No,15,"Plunge the curved sword into the ground, building power before unleashing a freezing storm that batters the surroundings.",Default skill on the Zamor Curved Sword.,0
231,Radahn's Rain,http://eldenring.wiki.fextralife.com/file/Elden-Ring/skill-radahns-rain-elden-ring-wiki-480px.gif,Unique,Lion Greatbow,No,- (25 -),Archery skill performed from a low stance. Ready the bow and fire a sudden flurry of arrows up into the sky. The arrows will pour on foes like rain.,Default skill of the Lion Greatbow.,0
232,The Queen's Black Flame,http://eldenring.wiki.fextralife.com/file/Elden-Ring/skill-the-queens-black-flame-elden-ring-wiki-480px.gif,Unique,Godslayer Greatsword,No,15,Set the blade ablaze with the god-slaying black flame before delivering a sweeping slash. Additional input allows for a follow-up attack. The black flames will continue to wear down HP for a while.,Default skill on the Godslayer Greatsword.,0
233,Dynast's Finesse,http://eldenring.wiki.fextralife.com/file/Elden-Ring/skill-dynasts-finesse-elden-ring-wiki-480px.gif,Unique,Bloody Helice,No,5 ( -7),"Nimbly avoid an attack, securing some distance from foes. Follow up with strong attack to perform a sudden lunge, and press strong attack again to perform a sweeping slice.",Default skill on the Bloody Helice.,0
234,Magma Shower,http://eldenring.wiki.fextralife.com/file/Elden-Ring/skill-magma-shower-elden-ring-wiki-480px.gif,Unique,Magma Blade,No,12,Slash at foes in a twirling motion while scattering magma all around.Additional input allows for a follow-up attack.,Default skill on the Magma Blade.,0
235,Death Flare,http://eldenring.wiki.fextralife.com/file/Elden-Ring/skill-death-flare-elden-ring-wiki-480px.gif,Unique,Eclipse Shotel,No,16,"Set the lusterless sun ablaze with the Prince of Death's flames, inflicting the death ailment upon foes.Follow up with an additional input to bring down the armament, triggering an explosion.",Default skill on the Eclipse Shotel.,0
236,Bloodhound's Finesse,http://eldenring.wiki.fextralife.com/file/Elden-Ring/skill-bloodhounds-finesse-elden-ring-wiki-480px.gif,Unique,Bloodhound's Fang,No,8 ( - 12),"Slash upwards with the Bloodhound's Fang, using the momentum of the strike to perform a backwards somersault and gain some distance from foes. Follow up with a strong attack to perform the Bloodhound's Step attack.",Default skill on the Bloodhound's Fang.,0
237,Magma Guillotine,http://eldenring.wiki.fextralife.com/file/Elden-Ring/magma_guillotine_gif.gif,Unique,Magma Wyrm's Scalesword,??,20 ( - 10),"Grab the scalesword with both hands, as a wyrm would hold it in its mouth, and leap forwards, smashing it into the ground and triggering a blast of magma. Follow up with an additional input to perform a chopping attack.",Default skill on the Magma Wyrm's Scalesword.,0
238,Corpse Piler,http://eldenring.wiki.fextralife.com/file/Elden-Ring/skill-corpse-piler-elden-ring-wiki-480px.gif,Unique,Rivers of Blood,No,17 ( - 9),"Forms a blade of cursed blood for repeated, interweaving successive attacks. Follow up with an additional input for further successive attacks.",Default skill on the Rivers of Blood.,0
239,Transient Moonlight,http://eldenring.wiki.fextralife.com/file/Elden-Ring/skill-transient-moonlight-elden-ring-wiki-480px.gif,Unique,Moonveil,No,- (15 20),"Sheathe blade, holding it at the hip in a composed stance.Follow up with either a normal or a strong attack to draw the blade at great speed for an instant slash attack. Both attacks fire off a wave of light.",Default skill on the Moonveil.,0
240,Bloodblade Dance,http://eldenring.wiki.fextralife.com/file/Elden-Ring/skill-bloodblade-dance-elden-ring-wiki-480px.gif,Unique,Eleonora's Poleblade,No,11,Leap at foe to perform a flurry of tornado-like attacks.Follow up with an additional input to perform an attack that ends in an evasive maneuver.,Default skill on the Eleonora's Poleblade.,0
241,Knowledge Above All,http://eldenring.wiki.fextralife.com/file/Elden-Ring/skill-knowledge-above-all-elden-ring-wiki-480px.gif,Unique,Scepter of the All-Knowing,No,35,"Raise the scepter to manifest the realm of the All-Knowing. Enemy magic and holy damage negation will be reduced for all within the area, including the caster.",Default skill on the Scepter of the All-Knowing.,0
242,Devourer of Worlds,http://eldenring.wiki.fextralife.com/file/Elden-Ring/skill-devourer-of-worlds-elden-ring-wiki-480px.gif,Unique,Devourer's Scepter,No,35,Charge the scepter with magic and strike it against the ground to steal the HP of all nearby enemies.,Default skill on the Devourer's Scepter.,0
243,Familial Rancor,http://eldenring.wiki.fextralife.com/file/Elden-Ring/skill-familial-rancor-elden-ring-wiki-480px.gif,Unique,Family Heads,No,25,Gently rattle the copper heads to summon vengeful spirits that chase down foes.The anguish of a spouse and children invites accursed wrath.,Default skill on the Family Heads.,0
244,Rosus's Summons,http://eldenring.wiki.fextralife.com/file/Elden-Ring/skill-rosus-summons-elden-ring-wiki-480px.gif,Unique,Rosus' Axe,No,15,Raise the axe aloft to summon those lost in death.Three skeletons will appear at a distance and attack in tandem before vanishing.,Default skill on the Rosus' Axe.,0
245,Thunderstorm,http://eldenring.wiki.fextralife.com/file/Elden-Ring/skill-thunderstorm-elden-ring-wiki-480px.gif,Unique,Stormhawk Axe,No,19 ( - 12),Imbue the armament's wing-blade with lightning and swing it around to create a tempestuous lightning storm. Follow up with an additional input to perform up to two spinning attacks. The lightning will stay on the blade for a while.,Default skill on the Stormhawk Axe.,0
246,Sacred Phalanx,http://eldenring.wiki.fextralife.com/file/Elden-Ring/skill-sacred-phalanx-elden-ring-wiki-480px.gif,Unique,Cleanrot Spear,No,12,Release the power of a hidden incantation to erect a palisade of golden spears frontwards.,"Drops from the spear wielding Cleanrot Knights just south of the Heart of Aeonia by Commander O'Neil (very low drop rate).
It can also drop from the ghostly Cleanrot Knights in the War-Dead Catacombs.
Drops from the spear wielding Cleanrot Knights in Elphael, Brace of the Haligtree. Closest is directly outside the ""Prayer Room"" Site of Grace (very low drop rate).",0
247,Great-Serpent Hunt,http://eldenring.wiki.fextralife.com/file/Elden-Ring/skill-great-serpent-hunt-elden-ring-wiki-480px.gif,Unique,Serpent-Hunter,No,30,"Perform a powerful forward lunge and follow up with an upward thrust via additional input. When fightning a great serpent, a long blade of light will appear, revealing the armament's true power.",Default skill on the Serpent-Hunter.,0
248,Angel's Wings,http://eldenring.wiki.fextralife.com/file/Elden-Ring/skill-angels-wings-elden-ring-wiki-480px.gif,Unique,Winged Scythe,No,17,"Jump and imbue the wing-blade of the armament with light, then deliver a slashing attack on the enemy. The white wings impede recovery actions using a flask of tears.",Default skill on the Winged Scythe.,0
249,Storm Kick,http://eldenring.wiki.fextralife.com/file/Elden-Ring/skill-storm-kick-elden-ring-wiki-480px.gif,Unique,Veteran's Prosthesis,No,10,"Thrust the prosthetic leg blade into the ground, creating a storm.Follow up with a strong attack to perform a lightning-infused jumping attack.",Default skill for the Veteran's Prosthesis.,0
250,Sorcery of the Crozier,http://eldenring.wiki.fextralife.com/file/Elden-Ring/skill-sorcery-of-the-crozier-elden-ring-wiki-480px.gif,Unique,Watchdog's Staff,No,15,"Channel magic into the glintstone to activate an ancient sorcery, producing floating magic projectiles that chase enemies automatically.",Default skill on the Watchdog's Staff.,0
251,Erdtree Slam,http://eldenring.wiki.fextralife.com/file/Elden-Ring/skill-erdtree-slam-elden-ring-wiki-480px.gif,Unique,Staff of the AvatarRotten Staff,No,19,Jump high up into the air and crash down on the ground ahead. The resulting pratfall sends golden shockwaves in all directions. This is the most powerful of all the Ground Slam skills.,Unique skill of Staff of the Avatar and Rotten Staff.,0
252,Gravity Bolt,http://eldenring.wiki.fextralife.com/file/Elden-Ring/skill-gravity-bolt-elden-ring-wiki-480px.gif,Unique,Fallingstar Beast Jaw,No,13 (-13),"Imbue the jaw of fallingstar beast with gravitational lightning, sending a bolt crashing down a short distance away. Can be fired in rapid succession.",Default skill on the Fallingstar Beast Jaw.,0
253,Fires of Slumber,http://eldenring.wiki.fextralife.com/file/Elden-Ring/skill-fires-of-slumber-elden-ring-wiki-480px.gif,Unique,St Trina's Torch,No,15,"Blow into the candlestick's flame, creating a stream of hazy purple fire to cover the ground ahead.The intoxicating flames inflict the sleep ailment upon foes.",Default skill on St Trina's Torch.,0
254,Golden Retaliation,http://eldenring.wiki.fextralife.com/file/Elden-Ring/golden_retaliation_gif_elden_ring_wiki_guide.gif,Unique,Erdtree Greatshield,No,4,"Ready the shield to unleash its protective incantation.This will dispel sorceries and incantations, retaliating with golden power.",Unique skill of Erdtree Greatshield.,0
255,Contagious Fury,http://eldenring.wiki.fextralife.com/file/Elden-Ring/skill-contagious-fury-elden-ring-wiki-480px.gif,Unique,Jellyfish Shield,No,9,Incite the jellyfish's wrath and allow its fury to flow through you.Raises attack power for a certain duration.,Default skill on the Jellyfish Shield.,0
